id,date,input,output
744,2011,Maikel Kieftenbeld plays for <extra_id_0>.,<extra_id_0> Netherlands national under-21 football team <extra_id_1>
745,2011,Martin Hamilton-Smith is a member of the <extra_id_0>.,<extra_id_0> Liberal Party of Australia <extra_id_1>
746,2011,Yong Hye-in is a member of the <extra_id_0>.,<extra_id_0> Labor Party <extra_id_1>
747,2011,Andy Carroll plays for <extra_id_0>.,<extra_id_0> Newcastle United F.C. <extra_id_1>
748,2011,André Schembri plays for <extra_id_0>.,<extra_id_0> Ferencvárosi TC <extra_id_1>
749,2011,Carlos Zambrano plays for <extra_id_0>.,<extra_id_0> FC St. Pauli <extra_id_1>
750,2011,<extra_id_0> is the head of the government of Vitré Communauté.,<extra_id_0> Pierre Méhaignerie <extra_id_1>
751,2011,Østfold Line is owned by <extra_id_0>.,<extra_id_0> Norwegian National Rail Administration <extra_id_1>
752,2011,Kaja Kallas works for <extra_id_0>.,<extra_id_0> Estonian Business School <extra_id_1>
753,2011,Dimitris Kremastinos is a member of the <extra_id_0>.,<extra_id_0> Panhellenic Socialist Movement <extra_id_1>
754,2011,Oliver Letwin holds the position of <extra_id_0>.,<extra_id_0> minister of state <extra_id_1>
755,2011,Li Keqiang holds the position of <extra_id_0>.,<extra_id_0> Vice Premier of the State Council of the People's Republic of China <extra_id_1>
756,2011,<extra_id_0> is the head of the government of Saguenay.,<extra_id_0> Jean Tremblay <extra_id_1>
757,2011,<extra_id_0> is the head coach of Yuzuru Hanyū.,<extra_id_0> Nanami Abe <extra_id_1>
758,2011,Călin Popescu-Tăriceanu is a member of the <extra_id_0>.,<extra_id_0> National Liberal Party <extra_id_1>
759,2011,Levi Mackin plays for <extra_id_0>.,<extra_id_0> Alfreton Town F.C. <extra_id_1>
760,2011,Tyler Dorsey attended <extra_id_0>.,<extra_id_0> St. John Bosco High School <extra_id_1>
761,2011,Fabián Caballero plays for <extra_id_0>.,<extra_id_0> C.S.D. Municipal <extra_id_1>
762,2011,<extra_id_0> is the head of the government of Saratov Oblast.,<extra_id_0> Pavel Ipatov <extra_id_1>
763,2011,Jacqui Lambie is a member of the <extra_id_0>.,<extra_id_0> Liberal Party of Australia <extra_id_1>
764,2011,Tim Walz holds the position of <extra_id_0>.,<extra_id_0> United States representative <extra_id_1>
765,2011,<extra_id_0> is the chair of Union of European Football Associations.,<extra_id_0> Michel Platini <extra_id_1>
766,2011,Shpend Ahmeti is a member of the <extra_id_0>.,<extra_id_0> Vetëvendosje! <extra_id_1>
767,2011,Chris Turney works for <extra_id_0>.,<extra_id_0> University of New South Wales <extra_id_1>
768,2011,Viviane Reding holds the position of <extra_id_0>.,"<extra_id_0> European Commissioner for Justice, Fundamental Rights and Citizenship <extra_id_1>"
769,2011,Jim Murphy holds the position of <extra_id_0>.,<extra_id_0> Shadow Secretary of State for Defence <extra_id_1>
770,2011,U. Reneé Hall works for <extra_id_0>.,<extra_id_0> Detroit Police Department <extra_id_1>
771,2011,Jim Justice is a member of the <extra_id_0>.,<extra_id_0> Republican Party <extra_id_1>
772,2011,Ari Kelman works for <extra_id_0>.,"<extra_id_0> University of California, Davis <extra_id_1>"
773,2011,Politico Europe is owned by <extra_id_0>.,<extra_id_0> Economist Group <extra_id_1>
774,2011,Sonja Kovač attended <extra_id_0>.,<extra_id_0> Faculty of Law of the University of Zagreb <extra_id_1>
775,2011,Jacques Le Nay is a member of the <extra_id_0>.,<extra_id_0> Union for a Popular Movement <extra_id_1>
776,2011,<extra_id_0> is the head of the government of Plzeň Region.,<extra_id_0> Milan Chovanec <extra_id_1>
777,2011,Adrian Peterson plays for <extra_id_0>.,<extra_id_0> Minnesota Vikings <extra_id_1>
778,2011,Naz Baloch is a member of the <extra_id_0>.,<extra_id_0> Pakistan Peoples Party <extra_id_1>
779,2011,Kylie Moore-Gilbert attended <extra_id_0>.,<extra_id_0> University of Cambridge <extra_id_1>
780,2011,<extra_id_0> is the chair of Economic Community of West African States.,<extra_id_0> Goodluck Jonathan <extra_id_1>
781,2011,Edna Molewa holds the position of <extra_id_0>.,<extra_id_0> Minister of Water and Environmental Affairs <extra_id_1>
782,2011,Adam Hammill plays for <extra_id_0>.,<extra_id_0> England national under-21 football team <extra_id_1>
783,2011,Anne-Sophie Lapix works for <extra_id_0>.,<extra_id_0> Canal+ <extra_id_1>
784,2011,Monty Panesar plays for <extra_id_0>.,<extra_id_0> Sussex County Cricket Club <extra_id_1>
785,2011,Anthony Annan plays for <extra_id_0>.,<extra_id_0> Ghana national football team <extra_id_1>
786,2011,<extra_id_0> is the head of the government of Nagykanizsa.,<extra_id_0> Péter Cseresnyés <extra_id_1>
787,2011,Sorin Cîmpeanu is a member of the <extra_id_0>.,<extra_id_0> Alliance of Liberals and Democrats Party (Romania) <extra_id_1>
788,2011,Ashlyn Harris plays for <extra_id_0>.,<extra_id_0> Western New York Flash <extra_id_1>
789,2011,Naomichi Ueda plays for <extra_id_0>.,<extra_id_0> Japan national under-17 football team <extra_id_1>
790,2011,Marios Matsakis is a member of the <extra_id_0>.,<extra_id_0> independent politician <extra_id_1>
791,2011,Ricardo Carvalho plays for <extra_id_0>.,<extra_id_0> Real Madrid CF <extra_id_1>
792,2011,Rhyne Howard attended <extra_id_0>.,<extra_id_0> Bradley Central High School <extra_id_1>
793,2011,<extra_id_0> is the head of the government of Gävleborg county.,<extra_id_0> Barbro Holmberg <extra_id_1>
794,2011,Joachim Starbatty is a member of the <extra_id_0>.,<extra_id_0> Alternative for Germany <extra_id_1>
795,2011,Toni Postius Terrado is a member of the <extra_id_0>.,<extra_id_0> Democratic Convergence of Catalonia <extra_id_1>
796,2011,Anna Theologou is a member of the <extra_id_0>.,<extra_id_0> Solidarity Movement (Cyprus) <extra_id_1>
797,2011,<extra_id_0> is the chair of Social Democratic Party of Germany.,<extra_id_0> Sigmar Gabriel <extra_id_1>
798,2011,<extra_id_0> is the chair of Asian Development Bank.,<extra_id_0> Haruhiko Kuroda <extra_id_1>
799,2011,Barbara Graziosi works for <extra_id_0>.,<extra_id_0> Durham University <extra_id_1>
800,2011,<extra_id_0> is the chair of People's Freedom Party.,<extra_id_0> Vladimir Ryzhkov <extra_id_1>
801,2011,Helen Clare Bostock works for <extra_id_0>.,<extra_id_0> National Institute of Water and Atmospheric Research <extra_id_1>
802,2011,Monica Macovei is a member of the <extra_id_0>.,<extra_id_0> Democratic Liberal Party <extra_id_1>
803,2011,Andrés Iniesta plays for <extra_id_0>.,<extra_id_0> FC Barcelona <extra_id_1>
804,2011,Noemí de Miguel works for <extra_id_0>.,<extra_id_0> Canal+ <extra_id_1>
805,2011,Cha Du-ri plays for <extra_id_0>.,<extra_id_0> South Korea national football team <extra_id_1>
806,2011,Henrietta Harrison works for <extra_id_0>.,<extra_id_0> Harvard University <extra_id_1>
807,2011,"<extra_id_0> is the chair of Embassy of Ukraine, Minsk.",<extra_id_0> Víktor Tykhonov <extra_id_1>
808,2011,Peadar Tóibín is a member of the <extra_id_0>.,<extra_id_0> Sinn Féin <extra_id_1>
809,2011,Ramires plays for <extra_id_0>.,<extra_id_0> Brazil national football team <extra_id_1>
810,2011,Vassilis Spanoulis plays for <extra_id_0>.,<extra_id_0> Olympiacos B.C. <extra_id_1>
811,2011,Westfield Montgomery is owned by <extra_id_0>.,<extra_id_0> Westfield Group <extra_id_1>
812,2011,Kelsey Plum attended <extra_id_0>.,<extra_id_0> La Jolla Country Day School <extra_id_1>
813,2011,Wojciech Szczęsny plays for <extra_id_0>.,<extra_id_0> Arsenal F.C. <extra_id_1>
814,2011,Paavo Väyrynen holds the position of <extra_id_0>.,<extra_id_0> Minister for European Affairs and Foreign Trade <extra_id_1>
815,2011,Paavo Väyrynen is a member of the <extra_id_0>.,<extra_id_0> Centre Party <extra_id_1>
816,2011,Jack Wilshere plays for <extra_id_0>.,<extra_id_0> Arsenal F.C. <extra_id_1>
817,2011,Mahathir Mohamad is a member of the <extra_id_0>.,<extra_id_0> United Malays National Organisation <extra_id_1>
818,2011,<extra_id_0> is the head coach of France national rugby league team.,<extra_id_0> Bobbie Goulding <extra_id_1>
819,2011,Patrick Kisnorbo plays for <extra_id_0>.,<extra_id_0> Leeds United F.C. <extra_id_1>
820,2011,Mesut Özil plays for <extra_id_0>.,<extra_id_0> Real Madrid CF <extra_id_1>
821,2011,Marcelo Díaz plays for <extra_id_0>.,<extra_id_0> Club Universidad de Chile <extra_id_1>
822,2011,Marie-Christine Blandin is a member of the <extra_id_0>.,<extra_id_0> Europe Ecology – The Greens <extra_id_1>
823,2011,F. Richard Spencer holds the position of <extra_id_0>.,<extra_id_0> auxiliary bishop <extra_id_1>
824,2011,Clifford Williams works for <extra_id_0>.,<extra_id_0> Trinity International University <extra_id_1>
825,2011,Claudio Nastruzzi works for <extra_id_0>.,<extra_id_0> University of Ferrara <extra_id_1>
826,2011,Chris Porter plays for <extra_id_0>.,<extra_id_0> Derby County F.C. <extra_id_1>
827,2011,Joyce Banda holds the position of <extra_id_0>.,<extra_id_0> Vice President of Malawi <extra_id_1>
828,2011,Frank Lampard plays for <extra_id_0>.,<extra_id_0> England national association football team <extra_id_1>
829,2011,David McNarry is a member of the <extra_id_0>.,<extra_id_0> Ulster Unionist Party <extra_id_1>
830,2011,<extra_id_0> is the head of the government of Nur-Sultan.,<extra_id_0> Imangali Tasmagambetov <extra_id_1>
831,2011,Paola Pabón is a member of the <extra_id_0>.,<extra_id_0> PAIS Alliance <extra_id_1>
832,2011,<extra_id_0> is the head of the government of Guinea.,<extra_id_0> Mamady Youla <extra_id_1>
833,2011,Vera Papisova works for <extra_id_0>.,<extra_id_0> Massachusetts General Hospital <extra_id_1>
834,2011,Jonah Berger works for <extra_id_0>.,<extra_id_0> University of Pennsylvania <extra_id_1>
835,2011,Clarence Seedorf plays for <extra_id_0>.,<extra_id_0> Associazione Calcio Milan <extra_id_1>
836,2011,Marc Bernhard is a member of the <extra_id_0>.,<extra_id_0> Christian Democratic Union <extra_id_1>
837,2011,Jonas Gahr Støre holds the position of <extra_id_0>.,<extra_id_0> Foreign Minister of Norway <extra_id_1>
838,2011,Vyacheslav Volodin holds the position of <extra_id_0>.,<extra_id_0> Deputy Chairman of the Government of the Russian Federation <extra_id_1>
839,2011,Jan Vertonghen plays for <extra_id_0>.,<extra_id_0> AFC Ajax <extra_id_1>
840,2011,Fernando Cheung is a member of the <extra_id_0>.,<extra_id_0> Labour Party <extra_id_1>
841,2011,Virgil van Dijk plays for <extra_id_0>.,<extra_id_0> Netherlands national under-19 football team <extra_id_1>
842,2011,Indira Alfonzo works for <extra_id_0>.,<extra_id_0> Universidad Militar Bolivariana de Venezuela <extra_id_1>
843,2011,Daniel Inouye holds the position of <extra_id_0>.,<extra_id_0> United States senator <extra_id_1>
844,2011,Paolo Alli is a member of the <extra_id_0>.,<extra_id_0> The People of Freedom <extra_id_1>
845,2011,Angelino Alfano is a member of the <extra_id_0>.,<extra_id_0> The People of Freedom <extra_id_1>
846,2011,Gerardo Buganza is a member of the <extra_id_0>.,<extra_id_0> Institutional Revolutionary Party <extra_id_1>
847,2011,Renato Schifani holds the position of <extra_id_0>.,<extra_id_0> President of the Italian Senate <extra_id_1>
