index,original,date,input,output
713,7781,2013,Ruth Haas works for <extra_id_0>.,<extra_id_0> Smith College <extra_id_1>
714,7794,2013,<extra_id_0> is the chair of Pomona College.,<extra_id_0> David W. Oxtoby <extra_id_1>
715,7805,2013,Stavne–Leangen Line is owned by <extra_id_0>.,<extra_id_0> Norwegian National Rail Administration <extra_id_1>
716,7816,2013,Alessandro Nesta plays for <extra_id_0>.,<extra_id_0> Montreal Impact <extra_id_1>
717,7821,2013,Moussa Sissoko plays for <extra_id_0>.,<extra_id_0> Newcastle United F.C. <extra_id_1>
718,7829,2013,Nasir-ul-Mulk holds the position of <extra_id_0>.,<extra_id_0> Chief Election Commissioner of Pakistan <extra_id_1>
719,7836,2013,Deshaun Thomas plays for <extra_id_0>.,<extra_id_0> Ohio State Buckeyes men's basketball <extra_id_1>
720,7842,2013,John Baird holds the position of <extra_id_0>.,<extra_id_0> Minister of Foreign Affairs of Canada <extra_id_1>
721,7848,2013,Sintra Line is owned by <extra_id_0>.,<extra_id_0> REFER <extra_id_1>
722,7862,2013,Dan Koehl works for <extra_id_0>.,<extra_id_0> Karlsruhe Zoo <extra_id_1>
723,7873,2013,Joe Hart plays for <extra_id_0>.,<extra_id_0> Manchester City F.C. <extra_id_1>
724,7884,2013,Rémi Mathis works for <extra_id_0>.,<extra_id_0> Bibliothèque nationale de France <extra_id_1>
725,7895,2013,<extra_id_0> is the head of the government of Sector 5.,<extra_id_0> Marian Vanghelie <extra_id_1>
726,7906,2013,Alexander Kačaniklić plays for <extra_id_0>.,<extra_id_0> Burnley F.C. <extra_id_1>
727,7917,2013,<extra_id_0> is the head of the government of Kagoshima Prefecture.,<extra_id_0> Yūichirō Itō <extra_id_1>
728,7928,2013,Patrick Reslow is a member of the <extra_id_0>.,<extra_id_0> Moderate Party <extra_id_1>
729,7950,2013,Virginia Barbour works for <extra_id_0>.,<extra_id_0> Public Library of Science <extra_id_1>
730,7961,2013,Yang Jiechi holds the position of <extra_id_0>.,<extra_id_0> Foreign Minister of the People's Republic of China <extra_id_1>
731,7972,2013,Mario Mandžukić plays for <extra_id_0>.,<extra_id_0> Croatia national association football team <extra_id_1>
732,7982,2013,Susanna Ceccardi holds the position of <extra_id_0>.,<extra_id_0> councillor <extra_id_1>
733,7989,2013,Daniel Ricciardo plays for <extra_id_0>.,<extra_id_0> Scuderia Toro Rosso <extra_id_1>
734,7999,2013,John Konchar attended <extra_id_0>.,<extra_id_0> Community High School <extra_id_1>
735,8009,2013,Selkent is owned by <extra_id_0>.,<extra_id_0> Stagecoach Group <extra_id_1>
736,8023,2013,Leslie M. Hicks works for <extra_id_0>.,<extra_id_0> University of North Carolina at Chapel Hill <extra_id_1>
737,8044,2013,<extra_id_0> is the head coach of SKN St. Pölten.,<extra_id_0> Martin Scherb <extra_id_1>
738,8052,2013,Olav Gunnar Ballo is a member of the <extra_id_0>.,<extra_id_0> Norwegian Labour Party <extra_id_1>
739,8063,2013,Matt Stainbrook attended <extra_id_0>.,<extra_id_0> Xavier University <extra_id_1>
740,8067,2013,<extra_id_0> is the chair of PSL Research University.,<extra_id_0> Monique Canto-Sperber <extra_id_1>
741,8090,2013,<extra_id_0> is the chair of Danish People's Party.,<extra_id_0> Kristian Thulesen Dahl <extra_id_1>
742,8102,2013,Joyce Beatty holds the position of <extra_id_0>.,<extra_id_0> United States representative <extra_id_1>
743,8112,2013,<extra_id_0> is the head of the government of Spain.,<extra_id_0> Mariano Rajoy <extra_id_1>
744,8123,2013,Gilda A Barabino works for <extra_id_0>.,<extra_id_0> City College of New York <extra_id_1>
745,8134,2013,<extra_id_0> is the head coach of Greenock Morton F.C..,<extra_id_0> Allan Moore <extra_id_1>
746,8141,2013,Chuck Grassley holds the position of <extra_id_0>.,<extra_id_0> United States senator <extra_id_1>
747,8152,2013,Andrés Manuel López Obrador is a member of the <extra_id_0>.,<extra_id_0> Party of the Democratic Revolution <extra_id_1>
748,8166,2013,Gillian Rose works for <extra_id_0>.,<extra_id_0> The Open University <extra_id_1>
749,8177,2013,John R. Curtis holds the position of <extra_id_0>.,<extra_id_0> mayor <extra_id_1>
750,8194,2013,Petr Bystron is a member of the <extra_id_0>.,<extra_id_0> Alternative for Germany <extra_id_1>
751,8205,2013,Radim Fiala is a member of the <extra_id_0>.,<extra_id_0> Dawn of Direct Democracy <extra_id_1>
752,8216,2013,<extra_id_0> is the head coach of New Zealand national rugby union team.,<extra_id_0> Steve Hansen <extra_id_1>
753,8227,2013,Dynabook is owned by <extra_id_0>.,<extra_id_0> Toshiba <extra_id_1>
754,8238,2013,<extra_id_0> is the head of the government of Chișinău.,<extra_id_0> Dorin Chirtoacă <extra_id_1>
755,8249,2013,Jack Dalrymple holds the position of <extra_id_0>.,<extra_id_0> Governor of North Dakota <extra_id_1>
756,8254,2013,Robert Upshaw attended <extra_id_0>.,"<extra_id_0> California State University, Fresno <extra_id_1>"
757,8260,2013,<extra_id_0> is the head of the government of Northern Cape.,<extra_id_0> Sylvia Lucas <extra_id_1>
758,8271,2013,Dimitris Syllouris is a member of the <extra_id_0>.,<extra_id_0> European Party <extra_id_1>
759,8282,2013,Damian Boeselager attended <extra_id_0>.,<extra_id_0> Columbia University <extra_id_1>
760,8290,2013,José Holebas plays for <extra_id_0>.,<extra_id_0> Olympiacos F.C. <extra_id_1>
761,8307,2013,Phil Hogan holds the position of <extra_id_0>.,<extra_id_0> Teachta Dála <extra_id_1>
762,8325,2013,Ali Karimi plays for <extra_id_0>.,<extra_id_0> Persepolis F.C. <extra_id_1>
763,8330,2013,Donna Riley works for <extra_id_0>.,<extra_id_0> Smith College <extra_id_1>
764,8341,2013,Brock Turner attended <extra_id_0>.,<extra_id_0> Oakwood High School <extra_id_1>
765,8347,2013,Christian Eriksen plays for <extra_id_0>.,<extra_id_0> AFC Ajax <extra_id_1>
766,8358,2013,Mario Götze plays for <extra_id_0>.,<extra_id_0> Germany national association football team <extra_id_1>
767,8368,2013,Susana Mendoza holds the position of <extra_id_0>.,<extra_id_0> City Clerk of Chicago <extra_id_1>
768,8377,2013,Yoshihide Suga holds the position of <extra_id_0>.,<extra_id_0> Chief Cabinet Secretary <extra_id_1>
769,8388,2013,Peter Vorderer works for <extra_id_0>.,<extra_id_0> University of Mannheim <extra_id_1>
770,8399,2013,Ivica Dačić holds the position of <extra_id_0>.,<extra_id_0> Minister of Internal Affairs <extra_id_1>
771,8410,2013,Rodrigo Duterte holds the position of <extra_id_0>.,<extra_id_0> Mayor of Davao City <extra_id_1>
772,8421,2013,Glen Johnson plays for <extra_id_0>.,<extra_id_0> England national association football team <extra_id_1>
773,8430,2013,Pedro plays for <extra_id_0>.,<extra_id_0> FC Barcelona <extra_id_1>
774,8447,2013,Elis Bakaj plays for <extra_id_0>.,<extra_id_0> Albania national association football team <extra_id_1>
775,8458,2013,<extra_id_0> is the head of the government of Rhineland-Palatinate.,<extra_id_0> Malu Dreyer <extra_id_1>
776,8472,2013,Victor Ciorbea is a member of the <extra_id_0>.,<extra_id_0> National Liberal Party <extra_id_1>
777,8477,2013,Regina Ip holds the position of <extra_id_0>.,<extra_id_0> party leader <extra_id_1>
778,8488,2013,Sun Mobile Limited is owned by <extra_id_0>.,<extra_id_0> Telstra <extra_id_1>
779,8499,2013,<extra_id_0> is the head of the government of Berkeley.,<extra_id_0> Tom Bates <extra_id_1>
780,8515,2013,<extra_id_0> is the head of the government of Plzeň Region.,<extra_id_0> Milan Chovanec <extra_id_1>
781,8519,2013,Antoine Bozio works for <extra_id_0>.,<extra_id_0> Paris School of Economics <extra_id_1>
782,8530,2013,Yuvraj Singh plays for <extra_id_0>.,<extra_id_0> Pune Warriors India <extra_id_1>
783,8541,2013,Bradden Inman plays for <extra_id_0>.,<extra_id_0> Newcastle United F.C. <extra_id_1>
784,8552,2013,Milorad Dodik holds the position of <extra_id_0>.,<extra_id_0> President of Republika Srpska <extra_id_1>
785,8575,2013,Kamala Harris holds the position of <extra_id_0>.,<extra_id_0> Attorney General of California <extra_id_1>
786,8585,2013,Kristi Noem holds the position of <extra_id_0>.,<extra_id_0> United States representative <extra_id_1>
787,8601,2013,Alexander Rinnooy Kan works for <extra_id_0>.,<extra_id_0> University of Amsterdam <extra_id_1>
788,8612,2013,Michael Gove holds the position of <extra_id_0>.,<extra_id_0> Secretary of State for Education <extra_id_1>
789,8623,2013,<extra_id_0> is the head coach of JLT Condor.,<extra_id_0> Tom Southam <extra_id_1>
790,8632,2013,Elizabeth A. Fenn works for <extra_id_0>.,<extra_id_0> University of Colorado Boulder <extra_id_1>
791,8643,2013,Fernando Maura is a member of the <extra_id_0>.,"<extra_id_0> Union, Progress and Democracy <extra_id_1>"
792,8655,2013,<extra_id_0> is the head of the government of Limpopo.,<extra_id_0> Stanley Mathabatha <extra_id_1>
793,8666,2013,Matthew Spiranovic plays for <extra_id_0>.,<extra_id_0> Western Sydney Wanderers FC <extra_id_1>
794,8683,2013,Nikola Mirotić plays for <extra_id_0>.,<extra_id_0> Real Madrid Baloncesto <extra_id_1>
795,8693,2013,<extra_id_0> is the head coach of Torino F.C..,<extra_id_0> Gian Piero Ventura <extra_id_1>
796,8709,2013,Chris Martin plays for <extra_id_0>.,<extra_id_0> Derby County F.C. <extra_id_1>
797,8718,2013,Danny White works for <extra_id_0>.,<extra_id_0> University at Buffalo <extra_id_1>
798,8729,2013,Hillary Clinton holds the position of <extra_id_0>.,<extra_id_0> United States Secretary of State <extra_id_1>
799,8730,2013,Mathias Cormann holds the position of <extra_id_0>.,<extra_id_0> Minister for Finance of Australia <extra_id_1>
800,8741,2013,Hu Jintao holds the position of <extra_id_0>.,<extra_id_0> President of the People's Republic of China <extra_id_1>
801,8745,2013,Sanchez Watt plays for <extra_id_0>.,<extra_id_0> Arsenal F.C. <extra_id_1>
802,8760,2013,<extra_id_0> is the head coach of Czech Republic national association football team.,<extra_id_0> Michal Bílek <extra_id_1>
803,8771,2013,Guglielmo Borghetti holds the position of <extra_id_0>.,<extra_id_0> diocesan bishop <extra_id_1>
804,8782,2013,Duncan McFetridge is a member of the <extra_id_0>.,<extra_id_0> Liberal Party of Australia <extra_id_1>
805,8790,2013,Xabi Alonso plays for <extra_id_0>.,<extra_id_0> Real Madrid CF <extra_id_1>
806,8803,2013,Xavier Becerra holds the position of <extra_id_0>.,<extra_id_0> Democratic Caucus Chairman of the United States House of Representatives <extra_id_1>
807,8814,2013,<extra_id_0> is the head coach of Fremantle Football Club.,<extra_id_0> Ross Lyon <extra_id_1>
808,8823,2013,<extra_id_0> is the head coach of KÍ Klaksvík.,<extra_id_0> Páll Guðlaugsson <extra_id_1>
809,8833,2013,Carine Roitfeld works for <extra_id_0>.,<extra_id_0> Harper's Bazaar <extra_id_1>
810,8844,2013,Carolyn Abbate works for <extra_id_0>.,<extra_id_0> Harvard University <extra_id_1>
811,8855,2013,Kushboo is a member of the <extra_id_0>.,<extra_id_0> Dravida Munnetra Kazhagam <extra_id_1>
812,8869,2013,Thiago Silva plays for <extra_id_0>.,<extra_id_0> Brazil national football team <extra_id_1>
813,8884,2013,Donato Bruno is a member of the <extra_id_0>.,<extra_id_0> The People of Freedom <extra_id_1>
814,8893,2013,<extra_id_0> is the head of the government of Puerto Rico.,<extra_id_0> Alejandro García Padilla <extra_id_1>
815,8904,2013,<extra_id_0> is the chair of Russian Football Union.,<extra_id_0> Nikolai Tolstykh <extra_id_1>
816,8921,2013,Jan Thörnqvist holds the position of <extra_id_0>.,<extra_id_0> Chief of Navy <extra_id_1>
817,8930,2013,Per Mertesacker plays for <extra_id_0>.,<extra_id_0> Arsenal F.C. <extra_id_1>
818,8936,2013,<extra_id_0> is the head of the government of Rio de Janeiro.,<extra_id_0> Eduardo Paes <extra_id_1>
819,8954,2013,Roda Antar plays for <extra_id_0>.,<extra_id_0> Lebanon national football team <extra_id_1>
820,8961,2013,Daphne Bavelier works for <extra_id_0>.,<extra_id_0> University of Geneva <extra_id_1>
821,8972,2013,Jason Kenney holds the position of <extra_id_0>.,"<extra_id_0> Minister of Immigration, Refugees and Citizenship <extra_id_1>"
822,8980,2013,Gregory Fu works for <extra_id_0>.,<extra_id_0> California Institute of Technology <extra_id_1>
823,8991,2013,Marta Tufet works for <extra_id_0>.,<extra_id_0> Wellcome Trust <extra_id_1>
824,8999,2013,Adam Johnson plays for <extra_id_0>.,<extra_id_0> Sunderland A.F.C. <extra_id_1>
825,9013,2013,Sir George Young holds the position of <extra_id_0>.,<extra_id_0> Parliamentary Secretary to the Treasury <extra_id_1>
826,9017,2013,Xavier Bettel holds the position of <extra_id_0>.,<extra_id_0> Prime Minister of Luxembourg <extra_id_1>
827,9028,2013,Donington Hall is owned by <extra_id_0>.,<extra_id_0> Norton Motorcycle Company <extra_id_1>
828,9039,2013,Mihalj Kertes is a member of the <extra_id_0>.,<extra_id_0> Socialist Party of Serbia <extra_id_1>
829,9050,2013,<extra_id_0> is the chair of Liberal Party of Australia.,<extra_id_0> Tony Abbott <extra_id_1>
830,9065,2013,<extra_id_0> is the head coach of UTA Arad.,<extra_id_0> Cristian Todea <extra_id_1>
831,9076,2013,East London is owned by <extra_id_0>.,<extra_id_0> Stagecoach Group <extra_id_1>
832,9087,2013,Romain Grau is a member of the <extra_id_0>.,<extra_id_0> The Republicans <extra_id_1>
833,9098,2013,ADV Ocean Shield is owned by <extra_id_0>.,<extra_id_0> Australian Border Force <extra_id_1>
834,9106,2013,Pamela E. Harris works for <extra_id_0>.,<extra_id_0> United States Military Academy <extra_id_1>
835,9117,2013,Ryan-Zico Black plays for <extra_id_0>.,<extra_id_0> Guernsey F.C. <extra_id_1>
836,9128,2013,<extra_id_0> is the head of the government of Baden-Württemberg.,<extra_id_0> Winfried Kretschmann <extra_id_1>
837,9137,2013,Louise Edwards works for <extra_id_0>.,<extra_id_0> Yale University <extra_id_1>
838,9148,2013,<extra_id_0> is the chair of Democratic Action Party.,<extra_id_0> Karpal Singh <extra_id_1>
839,9159,2013,Ben Agathangelou works for <extra_id_0>.,<extra_id_0> Scuderia Ferrari <extra_id_1>
840,9177,2013,<extra_id_0> is the head of the government of Thuringia.,<extra_id_0> Christine Lieberknecht <extra_id_1>
841,9188,2013,Sewell Chan works for <extra_id_0>.,<extra_id_0> The New York Times <extra_id_1>
842,9199,2013,Riyad Mahrez plays for <extra_id_0>.,<extra_id_0> Le Havre AC <extra_id_1>
843,9210,2013,Greg Woolf works for <extra_id_0>.,<extra_id_0> University of St Andrews <extra_id_1>
844,9221,2013,Urmas Sutrop works for <extra_id_0>.,<extra_id_0> Institute of the Estonian Language <extra_id_1>
845,9232,2013,Jamie Ashdown plays for <extra_id_0>.,<extra_id_0> Leeds United F.C. <extra_id_1>
846,9238,2013,Rich Nugent holds the position of <extra_id_0>.,<extra_id_0> United States representative <extra_id_1>
847,9246,2013,Georgina Roberts works for <extra_id_0>.,<extra_id_0> Strides Arcolab <extra_id_1>
848,9257,2013,Lahcen Haddad is a member of the <extra_id_0>.,<extra_id_0> Popular Movement <extra_id_1>
849,9268,2013,Alexander Arguelles works for <extra_id_0>.,<extra_id_0> American University in the Emirates <extra_id_1>
850,9282,2013,Carlos Tevez plays for <extra_id_0>.,<extra_id_0> Manchester City F.C. <extra_id_1>
851,9291,2013,Dani Poyatos works for <extra_id_0>.,<extra_id_0> Bahrain national football team <extra_id_1>
852,9302,2013,Luke Wilkshire plays for <extra_id_0>.,<extra_id_0> Australia national association football team <extra_id_1>
853,9311,2013,<extra_id_0> is the head of the government of Georgia.,<extra_id_0> Bidzina Ivanishvili <extra_id_1>
854,9322,2013,<extra_id_0> is the head of the government of Saudi Arabia.,<extra_id_0> Abdullah of Saudi Arabia <extra_id_1>
855,9332,2013,John E. Potter holds the position of <extra_id_0>.,<extra_id_0> chief executive officer <extra_id_1>
856,9343,2013,Filipe Morais plays for <extra_id_0>.,<extra_id_0> Stevenage F.C. <extra_id_1>
857,9354,2013,Catherine Cortez Masto holds the position of <extra_id_0>.,<extra_id_0> Nevada Attorney General <extra_id_1>
858,9364,2013,<extra_id_0> is the head of the government of Australia.,<extra_id_0> Julia Gillard <extra_id_1>
859,9375,2013,Wang Qishan holds the position of <extra_id_0>.,<extra_id_0> Secretary of the Central Commission for Discipline Inspection <extra_id_1>
860,9395,2013,J. J. Redick plays for <extra_id_0>.,<extra_id_0> Los Angeles Clippers <extra_id_1>
861,9412,2013,Wilbur Ross is a member of the <extra_id_0>.,<extra_id_0> Democratic Party <extra_id_1>
862,9429,2013,Achmad Dimyati Natakusumah is a member of the <extra_id_0>.,<extra_id_0> United Development Party <extra_id_1>
863,9440,2013,AB de Villiers plays for <extra_id_0>.,<extra_id_0> Royal Challengers Bangalore <extra_id_1>
864,9458,2013,<extra_id_0> is the chair of Cabinet of Ministers of Ukraine.,<extra_id_0> Mykola Azarov <extra_id_1>
865,9472,2013,"Thomas A. Shannon, Jr. holds the position of <extra_id_0>.",<extra_id_0> Counselor of the United States Department of State <extra_id_1>
866,9484,2013,Xu Deshuai plays for <extra_id_0>.,<extra_id_0> Kitchee SC <extra_id_1>
867,9495,2013,Landon Donovan plays for <extra_id_0>.,<extra_id_0> United States men's national soccer team <extra_id_1>
868,9502,2013,Wayne Swan holds the position of <extra_id_0>.,<extra_id_0> Treasurer of Australia <extra_id_1>
869,9509,2013,Andrew Rambaut works for <extra_id_0>.,<extra_id_0> John E. Fogarty International Center <extra_id_1>
870,9520,2013,Ivan Rakitić plays for <extra_id_0>.,<extra_id_0> Sevilla FC <extra_id_1>
871,9531,2013,Charles M. Huber is a member of the <extra_id_0>.,<extra_id_0> Christian Democratic Union <extra_id_1>
872,9542,2013,Ignacio Gutiérrez works for <extra_id_0>.,<extra_id_0> Chilevisión <extra_id_1>
873,9553,2013,Phase 10 is owned by <extra_id_0>.,<extra_id_0> Mattel <extra_id_1>
874,9566,2013,Mario Gómez plays for <extra_id_0>.,<extra_id_0> Germany national association football team <extra_id_1>
875,9583,2013,"<extra_id_0> is the chair of Ministry of Culture, Sports and Tourism.",<extra_id_0> Choe Kwang-shik <extra_id_1>
876,9593,2013,Dalo Bucaram holds the position of <extra_id_0>.,<extra_id_0> Supreme director <extra_id_1>
877,9604,2013,Dalo Bucaram is a member of the <extra_id_0>.,<extra_id_0> Ecuadorian Roldosist Party <extra_id_1>
878,9615,2013,<extra_id_0> is the chair of Social Democrats.,<extra_id_0> Helle Thorning-Schmidt <extra_id_1>
879,9626,2013,Elaine Fox works for <extra_id_0>.,<extra_id_0> University of Essex <extra_id_1>
880,9650,2013,Stephen Dawson plays for <extra_id_0>.,<extra_id_0> Barnsley F.C. <extra_id_1>
881,9661,2013,Hilda Solis holds the position of <extra_id_0>.,<extra_id_0> United States Cabinet <extra_id_1>
882,9665,2013,Rosanna A Alegado works for <extra_id_0>.,<extra_id_0> University of Hawaii at Manoa <extra_id_1>
883,9681,2013,Eden Hazard plays for <extra_id_0>.,<extra_id_0> Chelsea F.C. <extra_id_1>
884,9689,2013,Catarina Macario attended <extra_id_0>.,<extra_id_0> Torrey Pines High School <extra_id_1>
885,9700,2013,<extra_id_0> is the head coach of UCF Knights football.,<extra_id_0> George O'Leary <extra_id_1>
886,9711,2013,Johann-Dietrich Wörner holds the position of <extra_id_0>.,<extra_id_0> director <extra_id_1>
887,9722,2013,Matthew Trundle works for <extra_id_0>.,<extra_id_0> University of Auckland <extra_id_1>
888,9731,2013,Jacqui Lambie is a member of the <extra_id_0>.,<extra_id_0> Clive Palmer's United Australia Party <extra_id_1>
889,9742,2013,<extra_id_0> is the chair of Anti-Defamation League.,<extra_id_0> Abraham Foxman <extra_id_1>
890,9757,2013,David Cicilline holds the position of <extra_id_0>.,<extra_id_0> United States representative <extra_id_1>
891,9770,2013,<extra_id_0> is the head coach of 1. FSV Mainz 05.,<extra_id_0> Thomas Tuchel <extra_id_1>
892,9781,2013,Brandon Clarke attended <extra_id_0>.,<extra_id_0> Desert Vista High School <extra_id_1>
893,9792,2013,Skøyen–Filipstad Line is owned by <extra_id_0>.,<extra_id_0> Norwegian National Rail Administration <extra_id_1>
894,9803,2013,<extra_id_0> is the chair of Socialist People's Party.,<extra_id_0> Annette Vilhelmsen <extra_id_1>
895,9813,2013,Alla Pugacheva is a member of the <extra_id_0>.,<extra_id_0> Civic Platform <extra_id_1>
896,9819,2013,<extra_id_0> is the chair of Liberal Youth of Sweden.,<extra_id_0> Linda Nordlund <extra_id_1>
897,9834,2013,Hwang Kyo-ahn is a member of the <extra_id_0>.,<extra_id_0> independent politician <extra_id_1>
898,9845,2013,Stadio Friuli is owned by <extra_id_0>.,<extra_id_0> Udine <extra_id_1>
899,9863,2013,Rachel Aldred works for <extra_id_0>.,<extra_id_0> University of Westminster <extra_id_1>
900,9873,2013,<extra_id_0> is the head coach of Unione Sportiva Sassuolo Calcio.,<extra_id_0> Eusebio Di Francesco <extra_id_1>
901,9884,2013,Guido van Rossum works for <extra_id_0>.,<extra_id_0> Dropbox <extra_id_1>
902,9892,2013,Erik Angner works for <extra_id_0>.,<extra_id_0> George Mason University <extra_id_1>
903,9917,2013,Shane Battier plays for <extra_id_0>.,<extra_id_0> Miami Heat <extra_id_1>
904,9922,2013,<extra_id_0> is the head of the government of San Francisco.,<extra_id_0> Ed Lee <extra_id_1>
905,9933,2013,Alessandro Del Piero plays for <extra_id_0>.,<extra_id_0> Sydney FC <extra_id_1>
906,9938,2013,The Academic Bookstore is owned by <extra_id_0>.,<extra_id_0> Stockmann <extra_id_1>
907,9948,2013,Rein Ahas works for <extra_id_0>.,<extra_id_0> Ghent University <extra_id_1>
908,9959,2013,Moon Jae-in is a member of the <extra_id_0>.,<extra_id_0> Democratic Party <extra_id_1>
909,9970,2013,Yuriy Boyko is a member of the <extra_id_0>.,<extra_id_0> Party of Regions <extra_id_1>
910,9985,2013,Serhiy Leshchenko is a member of the <extra_id_0>.,<extra_id_0> European Solidarity <extra_id_1>
911,9994,2013,Max Hattler works for <extra_id_0>.,<extra_id_0> Royal College of Art <extra_id_1>
912,10018,2013,<extra_id_0> is the head of the government of Delaware.,<extra_id_0> Jack Markell <extra_id_1>
913,10036,2013,<extra_id_0> is the head coach of FC Torpedo-BelAZ Zhodino.,<extra_id_0> Igor Kriushenko <extra_id_1>
914,10047,2013,Indianapolis Motor Speedway is owned by <extra_id_0>.,<extra_id_0> Hulman & Company <extra_id_1>
915,10059,2013,Gen Shoji plays for <extra_id_0>.,<extra_id_0> Kashima Antlers <extra_id_1>
916,10070,2013,Iñaki Gabilondo works for <extra_id_0>.,<extra_id_0> Canal+ <extra_id_1>
917,10080,2013,David Hurley holds the position of <extra_id_0>.,<extra_id_0> Chief of the Defence Force <extra_id_1>
918,10091,2013,Peter T. Gallagher works for <extra_id_0>.,<extra_id_0> Trinity College Dublin <extra_id_1>
919,10102,2013,Leïla Chaibi is a member of the <extra_id_0>.,<extra_id_0> Left Party <extra_id_1>
920,10113,2013,Russell Crowe's jockstrap is owned by <extra_id_0>.,<extra_id_0> Russell Crowe <extra_id_1>
921,10121,2013,John Tye works for <extra_id_0>.,<extra_id_0> United States Department of State <extra_id_1>
922,10132,2013,VK is owned by <extra_id_0>.,<extra_id_0> Yitzchak Mirilashvili <extra_id_1>
923,10137,2013,Priit Vilba is a member of the <extra_id_0>.,<extra_id_0> Estonian Reform Party <extra_id_1>
924,10148,2013,János Volner is a member of the <extra_id_0>.,<extra_id_0> Jobbik <extra_id_1>
925,10159,2013,Alexandre Lacazette plays for <extra_id_0>.,<extra_id_0> France national association football team <extra_id_1>
926,10170,2013,Luca Toni plays for <extra_id_0>.,<extra_id_0> Hellas Verona F.C. <extra_id_1>
927,10183,2013,Ulrike Lunacek holds the position of <extra_id_0>.,<extra_id_0> member of the European Parliament <extra_id_1>
928,10191,2013,<extra_id_0> is the chair of Union of the Centre.,<extra_id_0> Rocco Buttiglione <extra_id_1>
929,10202,2013,Heidi Allen is a member of the <extra_id_0>.,<extra_id_0> Conservative Party <extra_id_1>
930,10218,2013,Jæren Line is owned by <extra_id_0>.,<extra_id_0> Norwegian National Rail Administration <extra_id_1>
931,10229,2013,<extra_id_0> is the head of the government of Piedmont.,<extra_id_0> Roberto Cota <extra_id_1>
932,10240,2013,Steven Caulker plays for <extra_id_0>.,<extra_id_0> England national under-21 football team <extra_id_1>
933,10251,2013,Arturs Krišjānis Kariņš holds the position of <extra_id_0>.,<extra_id_0> member of the European Parliament <extra_id_1>
934,10262,2013,Ro Khanna works for <extra_id_0>.,<extra_id_0> Wilson Sonsini Goodrich & Rosati <extra_id_1>
935,10267,2013,Stade Pierre-Mauroy is owned by <extra_id_0>.,<extra_id_0> Eiffage <extra_id_1>
936,10278,2013,Gjergji Muzaka plays for <extra_id_0>.,<extra_id_0> Flamurtari Vlorë <extra_id_1>
937,10296,2013,Gilberto Silva plays for <extra_id_0>.,<extra_id_0> Clube Atlético Mineiro <extra_id_1>
938,10300,2013,Anthony Stokes plays for <extra_id_0>.,<extra_id_0> Republic of Ireland national association football team <extra_id_1>
939,10307,2013,<extra_id_0> is the head of the government of New Brunswick.,<extra_id_0> David Alward <extra_id_1>
940,10318,2013,"Ted Ginn, Jr. plays for <extra_id_0>.",<extra_id_0> Carolina Panthers <extra_id_1>
941,10329,2013,Pierre Moreau holds the position of <extra_id_0>.,<extra_id_0> Member of the National Assembly of Quebec <extra_id_1>
942,10338,2013,Rolf Buch works for <extra_id_0>.,<extra_id_0> Vonovia <extra_id_1>
943,10348,2013,Manu Carreño works for <extra_id_0>.,<extra_id_0> Mediaset España <extra_id_1>
944,10356,2013,Andrej Plenković holds the position of <extra_id_0>.,<extra_id_0> member of the European Parliament <extra_id_1>
945,10366,2013,Mark Sanford holds the position of <extra_id_0>.,<extra_id_0> United States representative <extra_id_1>
946,10375,2013,<extra_id_0> is the head of the government of British Virgin Islands.,<extra_id_0> Orlando Smith <extra_id_1>
947,10386,2013,Tommy Vietor works for <extra_id_0>.,<extra_id_0> United States National Security Council <extra_id_1>
948,10390,2013,Zoran Stojković is a member of the <extra_id_0>.,<extra_id_0> Democratic Party of Serbia <extra_id_1>
