index,original,date,input,output
1414,15401,2013,Joseph Bambera holds the position of <extra_id_0>.,<extra_id_0> diocesan bishop <extra_id_1>
1415,15412,2013,<extra_id_0> is the head coach of B36 Tórshavn.,<extra_id_0> Mikkjal Thomassen <extra_id_1>
1416,15427,2013,Luis Abinader is a member of the <extra_id_0>.,<extra_id_0> Dominican Revolutionary Party <extra_id_1>
1417,15438,2013,Linha do Sul is owned by <extra_id_0>.,<extra_id_0> REFER <extra_id_1>
1418,15449,2013,<extra_id_0> is the head coach of England national rugby union team.,<extra_id_0> Stuart Lancaster <extra_id_1>
1419,15460,2013,<extra_id_0> is the chair of Union of European Football Associations.,<extra_id_0> Michel Platini <extra_id_1>
1420,15471,2013,Edna Molewa holds the position of <extra_id_0>.,<extra_id_0> Minister of Water and Environmental Affairs <extra_id_1>
1421,15476,2013,<extra_id_0> is the head of the government of Jena.,<extra_id_0> Albrecht Schröter <extra_id_1>
1422,15487,2013,David M. Evans works for <extra_id_0>.,<extra_id_0> The University of Queensland <extra_id_1>
1423,15498,2013,Chris Hackett plays for <extra_id_0>.,<extra_id_0> Northampton Town F.C. <extra_id_1>
1424,15512,2013,Hong Moon-jong is a member of the <extra_id_0>.,<extra_id_0> Liberty Korea Party <extra_id_1>
1425,15523,2013,Noemí de Miguel works for <extra_id_0>.,<extra_id_0> Canal+ <extra_id_1>
1426,15534,2013,Rostelecom is owned by <extra_id_0>.,<extra_id_0> Federal Agency for State Property Management <extra_id_1>
1427,15545,2013,Matt Ouimet works for <extra_id_0>.,<extra_id_0> Cedar Fair <extra_id_1>
1428,15556,2013,Xavier Bertrand is a member of the <extra_id_0>.,<extra_id_0> Union for a Popular Movement <extra_id_1>
1429,15564,2013,<extra_id_0> is the head of the government of Vienna.,<extra_id_0> Michael Häupl <extra_id_1>
1430,15573,2013,Julian Assange is a member of the <extra_id_0>.,<extra_id_0> The Wikileaks Party <extra_id_1>
1431,15589,2013,<extra_id_0> is the head of the government of Nepal.,<extra_id_0> Baburam Bhattarai <extra_id_1>
1432,15600,2013,Fernando Torres plays for <extra_id_0>.,<extra_id_0> Chelsea F.C. <extra_id_1>
1433,15610,2013,Chris Dercon works for <extra_id_0>.,<extra_id_0> Tate Modern <extra_id_1>
1434,15621,2013,<extra_id_0> is the head coach of Green Bay Packers.,<extra_id_0> Mike McCarthy <extra_id_1>
1435,15635,2013,Jordi Sànchez i Picanyol is a member of the <extra_id_0>.,<extra_id_0> independent politician <extra_id_1>
1436,15651,2013,Michael Viscardi attended <extra_id_0>.,<extra_id_0> Massachusetts Institute of Technology <extra_id_1>
1437,15658,2013,Lawrie Wilson plays for <extra_id_0>.,<extra_id_0> Charlton Athletic F.C. <extra_id_1>
1438,15669,2013,Sergio Agüero plays for <extra_id_0>.,<extra_id_0> Manchester City F.C. <extra_id_1>
1439,15680,2013,"<extra_id_0> is the chair of Ministry of Popular Power for Interior, Justice and Peace.",<extra_id_0> Gustavo González López <extra_id_1>
1440,15691,2013,Thein Sein holds the position of <extra_id_0>.,<extra_id_0> President of Myanmar <extra_id_1>
1441,15698,2013,Mark Francois holds the position of <extra_id_0>.,<extra_id_0> Minister of State for the Armed Forces <extra_id_1>
1442,15709,2013,Robert Ling Kui Ee is a member of the <extra_id_0>.,<extra_id_0> People's Justice Party <extra_id_1>
1443,15720,2013,James Constable plays for <extra_id_0>.,<extra_id_0> Oxford United F.C. <extra_id_1>
1444,15736,2013,Marcos Aoás Corrêa plays for <extra_id_0>.,<extra_id_0> Brazil national football team <extra_id_1>
1445,15745,2013,Bob Carr holds the position of <extra_id_0>.,<extra_id_0> Minister for Foreign Affairs <extra_id_1>
1446,15747,2013,<extra_id_0> is the head coach of OL Reign.,<extra_id_0> Laura Harvey <extra_id_1>
1447,15756,2013,<extra_id_0> is the head coach of FK Sutjeska Nikšić.,<extra_id_0> Dragan Radojičić <extra_id_1>
1448,15771,2013,Zvjezdan Misimović plays for <extra_id_0>.,<extra_id_0> Guizhou Renhe F.C. <extra_id_1>
1449,15784,2013,Mirela Holy is a member of the <extra_id_0>.,<extra_id_0> Croatian Sustainable Development <extra_id_1>
1450,15795,2013,<extra_id_0> is the head coach of 1. FC Union Berlin.,<extra_id_0> Uwe Neuhaus <extra_id_1>
1451,15806,2013,Pamela Aguirre Zambonino is a member of the <extra_id_0>.,<extra_id_0> PAIS Alliance <extra_id_1>
1452,15817,2013,<extra_id_0> is the head coach of Denmark national association football team.,<extra_id_0> Morten Olsen <extra_id_1>
1453,15828,2013,Scott Andrews is a member of the <extra_id_0>.,<extra_id_0> Liberal Party of Canada <extra_id_1>
1454,15838,2013,Robert Biedroń is a member of the <extra_id_0>.,<extra_id_0> Palikot's Movement <extra_id_1>
1455,15845,2013,Darius Bogdan Vâlcov is a member of the <extra_id_0>.,<extra_id_0> Social Democratic Party <extra_id_1>
1456,15861,2013,Darijo Srna plays for <extra_id_0>.,<extra_id_0> Croatia national association football team <extra_id_1>
1457,15871,2013,Antoine Griezmann plays for <extra_id_0>.,<extra_id_0> Real Sociedad <extra_id_1>
1458,15882,2013,<extra_id_0> is the chair of Scottish Parliament.,<extra_id_0> Tricia Marwick <extra_id_1>
1459,15893,2013,<extra_id_0> is the chair of Federal Employment Agency of Germany.,<extra_id_0> Frank-Jürgen Weise <extra_id_1>
1460,15908,2013,John S. Chen works for <extra_id_0>.,<extra_id_0> BlackBerry <extra_id_1>
1461,15919,2013,Bonnie Henry works for <extra_id_0>.,<extra_id_0> University of British Columbia <extra_id_1>
1462,15929,2013,Chen Fu-hai is a member of the <extra_id_0>.,<extra_id_0> People First Party <extra_id_1>
1463,15940,2013,Muhammad Rizieq Shihab attended <extra_id_0>.,<extra_id_0> Universiti Sains Islam Malaysia <extra_id_1>
1464,15949,2013,Zack Greinke plays for <extra_id_0>.,<extra_id_0> Los Angeles Dodgers <extra_id_1>
1465,15960,2013,Angelino Alfano is a member of the <extra_id_0>.,<extra_id_0> The People of Freedom <extra_id_1>
1466,15976,2013,Ramón Luis Valcárcel Siso holds the position of <extra_id_0>.,<extra_id_0> President of the Region of Murcia <extra_id_1>
1467,15986,2013,Toni Postius Terrado is a member of the <extra_id_0>.,<extra_id_0> Democratic Convergence of Catalonia <extra_id_1>
1468,15997,2013,Kevin Love plays for <extra_id_0>.,<extra_id_0> Minnesota Timberwolves <extra_id_1>
1469,16007,2013,Dimitris Avramopoulos holds the position of <extra_id_0>.,<extra_id_0> Minister for National Defence of Greece <extra_id_1>
1470,16012,2013,Phillip Lee is a member of the <extra_id_0>.,<extra_id_0> Conservative Party <extra_id_1>
1471,16022,2013,Marcin Kubiak works for <extra_id_0>.,<extra_id_0> Ministry of Regional Development <extra_id_1>
1472,16041,2013,Younus Khan plays for <extra_id_0>.,<extra_id_0> Pakistan national cricket team <extra_id_1>
1473,16048,2013,Rosa Visiedo Claverol works for <extra_id_0>.,<extra_id_0> University CEU Cardenal Herrera <extra_id_1>
1474,16059,2013,Xi Mingze attended <extra_id_0>.,<extra_id_0> Harvard University <extra_id_1>
1475,16069,2013,Stephen Donnelly holds the position of <extra_id_0>.,<extra_id_0> Teachta Dála <extra_id_1>
1476,16097,2013,Stephen Cottrell holds the position of <extra_id_0>.,<extra_id_0> Bishop of Chelmsford <extra_id_1>
1477,16108,2013,TVNorge is owned by <extra_id_0>.,<extra_id_0> ProSiebenSat.1 Media SE <extra_id_1>
1478,16119,2013,<extra_id_0> is the head of the government of Denmark.,<extra_id_0> Helle Thorning-Schmidt <extra_id_1>
1479,16130,2013,Ashley Fox holds the position of <extra_id_0>.,<extra_id_0> member of the European Parliament <extra_id_1>
1480,16140,2013,<extra_id_0> is the chair of SWPS University of Social Sciences and Humanities.,<extra_id_0> Andrzej Eliasz <extra_id_1>
1481,16151,2013,Ueli Maurer holds the position of <extra_id_0>.,"<extra_id_0> Federal Department of Defence, Civil Protection and Sports <extra_id_1>"
1482,16160,2013,Mick Mulvaney holds the position of <extra_id_0>.,<extra_id_0> United States representative <extra_id_1>
1483,16170,2013,Sylvie Goulard is a member of the <extra_id_0>.,<extra_id_0> Democratic Movement <extra_id_1>
1484,16181,2013,Sylvie Goulard holds the position of <extra_id_0>.,<extra_id_0> member of the European Parliament <extra_id_1>
1485,16189,2013,<extra_id_0> is the chair of People's Party of the Balearic Islands.,<extra_id_0> José Ramón Bauzá <extra_id_1>
1486,16202,2013,Frantz Benjamin is a member of the <extra_id_0>.,<extra_id_0> Ensemble Montréal <extra_id_1>
1487,16215,2013,Freddie Sears plays for <extra_id_0>.,<extra_id_0> Colchester United F.C. <extra_id_1>
1488,16226,2013,Alan Shatter holds the position of <extra_id_0>.,<extra_id_0> Teachta Dála <extra_id_1>
1489,16233,2013,HMS Protector is owned by <extra_id_0>.,<extra_id_0> Ministry of Defence <extra_id_1>
1490,16244,2013,Richard Tol works for <extra_id_0>.,<extra_id_0> University of Sussex <extra_id_1>
1491,16255,2013,Uffe Elbæk is a member of the <extra_id_0>.,<extra_id_0> The Alternative <extra_id_1>
1492,16265,2013,Jackie Young attended <extra_id_0>.,<extra_id_0> Princeton Community High School <extra_id_1>
1493,16275,2013,"<extra_id_0> is the head of the government of Washington, D.C..",<extra_id_0> Vincent C. Gray <extra_id_1>
1494,16286,2013,Pedro Pierluisi holds the position of <extra_id_0>.,<extra_id_0> Resident Commissioner of Puerto Rico <extra_id_1>
1495,16295,2013,Stefan Niesiołowski is a member of the <extra_id_0>.,<extra_id_0> Civic Platform <extra_id_1>
1496,16306,2013,Santiago Abascal Conde is a member of the <extra_id_0>.,<extra_id_0> People's Party <extra_id_1>
1497,16317,2013,Miroslav Klose plays for <extra_id_0>.,<extra_id_0> Germany national association football team <extra_id_1>
1498,16324,2013,<extra_id_0> is the chair of ITV plc.,<extra_id_0> Archie Norman <extra_id_1>
1499,16343,2013,Amjad Kalaf plays for <extra_id_0>.,<extra_id_0> Iraq national under-23 football team <extra_id_1>
1500,16359,2013,Eric Swalwell holds the position of <extra_id_0>.,<extra_id_0> United States representative <extra_id_1>
1501,16367,2013,<extra_id_0> is the head coach of HNK Šibenik.,<extra_id_0> Damir Petravić <extra_id_1>
1502,16386,2013,<extra_id_0> is the head of the government of Saitama Prefecture.,<extra_id_0> Kiyoshi Ueda <extra_id_1>
1503,16394,2013,Moeen Ali plays for <extra_id_0>.,<extra_id_0> Rajshahi Kings <extra_id_1>
1504,16405,2013,Clint Dempsey plays for <extra_id_0>.,<extra_id_0> Tottenham Hotspur F.C. <extra_id_1>
1505,16410,2013,<extra_id_0> is the head of the government of Guadeloupe.,<extra_id_0> Victorin Lurel <extra_id_1>
1506,16419,2013,Myron Rolle attended <extra_id_0>.,<extra_id_0> Florida State University College of Medicine <extra_id_1>
1507,16431,2013,"David Neuberger, Baron Neuberger of Abbotsbury holds the position of <extra_id_0>.",<extra_id_0> President of the Supreme Court of the United Kingdom <extra_id_1>
1508,16439,2013,Marian Croak works for <extra_id_0>.,<extra_id_0> Bell Labs <extra_id_1>
1509,16450,2013,Gavin Mahon plays for <extra_id_0>.,<extra_id_0> Stevenage F.C. <extra_id_1>
1510,16455,2013,Brian Hayes holds the position of <extra_id_0>.,<extra_id_0> Teachta Dála <extra_id_1>
1511,16466,2013,Francis Chullikatt holds the position of <extra_id_0>.,<extra_id_0> Permanent Observer of the Holy See to the United Nations <extra_id_1>
1512,16476,2013,Luca De Meo works for <extra_id_0>.,<extra_id_0> Volkswagen Group <extra_id_1>
1513,16487,2013,Miloud Chaabi is a member of the <extra_id_0>.,<extra_id_0> Environment and Sustainable Development Party <extra_id_1>
1514,16498,2013,Mathieu Gallet works for <extra_id_0>.,<extra_id_0> Institut National de l'Audiovisuel <extra_id_1>
1515,16521,2013,<extra_id_0> is the head of the government of London.,<extra_id_0> Boris Johnson <extra_id_1>
1516,16529,2013,Saša Radulović is a member of the <extra_id_0>.,<extra_id_0> independent politician <extra_id_1>
1517,16537,2013,Raheel Sharif holds the position of <extra_id_0>.,<extra_id_0> Chief of Army Staff <extra_id_1>
1518,16548,2013,Lourdes Ciuró i Buldó is a member of the <extra_id_0>.,<extra_id_0> Democratic Convergence of Catalonia <extra_id_1>
1519,16559,2013,Bratsberg Line is owned by <extra_id_0>.,<extra_id_0> Norwegian National Rail Administration <extra_id_1>
1520,16570,2013,Jean-Pierre Grand is a member of the <extra_id_0>.,<extra_id_0> Union for a Popular Movement <extra_id_1>
1521,16581,2013,Bernhard Schölkopf works for <extra_id_0>.,<extra_id_0> Max Planck Institute for Intelligent Systems <extra_id_1>
1522,16592,2013,Neven Subotić plays for <extra_id_0>.,<extra_id_0> Serbia national football team <extra_id_1>
1523,16609,2013,Vassilis Spanoulis plays for <extra_id_0>.,<extra_id_0> Olympiacos B.C. <extra_id_1>
1524,16620,2013,Chris Smith plays for <extra_id_0>.,<extra_id_0> York City F.C. <extra_id_1>
1525,16637,2013,Mohammad Amir plays for <extra_id_0>.,<extra_id_0> Rawalpindi Rams <extra_id_1>
1526,16646,2013,<extra_id_0> is the head coach of Shamrock Rovers F.C..,<extra_id_0> Trevor Croly <extra_id_1>
1527,16653,2013,<extra_id_0> is the head coach of Calcio Padova.,<extra_id_0> Fulvio Pea <extra_id_1>
1528,16659,2013,Mircea Hava is a member of the <extra_id_0>.,<extra_id_0> Democratic Liberal Party <extra_id_1>
1529,16681,2013,Sussan Ley holds the position of <extra_id_0>.,<extra_id_0> Minister for Education <extra_id_1>
1530,16694,2013,Richard B. Spencer holds the position of <extra_id_0>.,<extra_id_0> executive director <extra_id_1>
1531,16705,2013,Têtu is owned by <extra_id_0>.,<extra_id_0> Pierre Bergé <extra_id_1>
1532,16711,2013,<extra_id_0> is the head coach of CS Mioveni.,<extra_id_0> Florin Marin <extra_id_1>
1533,16722,2013,Tanya Plibersek holds the position of <extra_id_0>.,<extra_id_0> Minister for Health <extra_id_1>
1534,16726,2013,Krisztián Németh plays for <extra_id_0>.,<extra_id_0> Hungary national association football team <extra_id_1>
1535,16737,2013,<extra_id_0> is the head of the government of Tulsa.,"<extra_id_0> Dewey F. Bartlett, Jr. <extra_id_1>"
1536,16745,2013,Eivind Ystrøm works for <extra_id_0>.,<extra_id_0> Norwegian Institute of Public Health <extra_id_1>
1537,16756,2013,<extra_id_0> is the chair of Alliance of Liberals and Democrats for Europe Party.,<extra_id_0> Graham Watson <extra_id_1>
1538,16767,2013,David Horsey works for <extra_id_0>.,<extra_id_0> Los Angeles Times <extra_id_1>
1539,16778,2013,Desmond Swayne holds the position of <extra_id_0>.,<extra_id_0> Lord of the Treasury <extra_id_1>
1540,16780,2013,Kyrsten Sinema holds the position of <extra_id_0>.,<extra_id_0> United States representative <extra_id_1>
1541,16791,2013,<extra_id_0> is the chair of Burberry.,<extra_id_0> John Peace <extra_id_1>
1542,16807,2013,Steven Gerrard plays for <extra_id_0>.,<extra_id_0> England national association football team <extra_id_1>
1543,16811,2013,Bernadette McSherry works for <extra_id_0>.,<extra_id_0> Monash University <extra_id_1>
1544,16822,2013,Sandra Jansen is a member of the <extra_id_0>.,<extra_id_0> Progressive Conservative Association of Alberta <extra_id_1>
1545,16847,2013,Andris Bērziņš is a member of the <extra_id_0>.,<extra_id_0> independent politician <extra_id_1>
1546,16858,2013,<extra_id_0> is the head coach of Atalanta B.C..,<extra_id_0> Stefano Colantuono <extra_id_1>
1547,16869,2013,GameRankings is owned by <extra_id_0>.,<extra_id_0> CBS Interactive <extra_id_1>
1548,16880,2013,Jazmin Grace Grimaldi attended <extra_id_0>.,<extra_id_0> Fordham University <extra_id_1>
1549,16885,2013,<extra_id_0> is the chair of Volga Federal District.,<extra_id_0> Mikhail Babich <extra_id_1>
1550,16896,2013,Patrick O'Shea works for <extra_id_0>.,<extra_id_0> University of Maryland <extra_id_1>
1551,16904,2013,<extra_id_0> is the head coach of FC Pyunik.,<extra_id_0> Rafael Nazaryan <extra_id_1>
1552,16911,2013,Jessica Ware works for <extra_id_0>.,<extra_id_0> Rutgers University–Newark <extra_id_1>
1553,16922,2013,Firdous Ashiq Awan is a member of the <extra_id_0>.,<extra_id_0> Pakistan Peoples Party <extra_id_1>
1554,16933,2013,<extra_id_0> is the head coach of FC Midtjylland.,<extra_id_0> Glen Riddersholm <extra_id_1>
1555,16942,2013,Kenneth Clarke holds the position of <extra_id_0>.,<extra_id_0> minister without portfolio <extra_id_1>
1556,16950,2013,Toni Kroos plays for <extra_id_0>.,<extra_id_0> Germany national association football team <extra_id_1>
1557,16961,2013,Elena Fernández works for <extra_id_0>.,<extra_id_0> Polytechnic University of Catalonia <extra_id_1>
1558,16975,2013,Luke Freeman plays for <extra_id_0>.,<extra_id_0> Stevenage F.C. <extra_id_1>
1559,16986,2013,Cheteshwar Pujara plays for <extra_id_0>.,<extra_id_0> India national cricket team <extra_id_1>
1560,16994,2013,Zoran Milanović holds the position of <extra_id_0>.,<extra_id_0> Prime Minister of Croatia <extra_id_1>
1561,17002,2013,<extra_id_0> is the head coach of FC Metaloglobus București.,<extra_id_0> Bogdan Vintilă <extra_id_1>
1562,17017,2013,<extra_id_0> is the chair of Assembly of Experts for Leadership.,<extra_id_0> Mahmoud Hashemi Shahroudi <extra_id_1>
1563,17028,2013,<extra_id_0> is the head coach of Team Jumbo-Visma.,<extra_id_0> Nico Verhoeven <extra_id_1>
1564,17039,2013,Yvette Cooper holds the position of <extra_id_0>.,<extra_id_0> Shadow Minister for Women and Equalities <extra_id_1>
1565,17045,2013,Luke Hancock attended <extra_id_0>.,<extra_id_0> University of Louisville <extra_id_1>
1566,17054,2013,Sölvi Ottesen plays for <extra_id_0>.,<extra_id_0> F.C. Copenhagen <extra_id_1>
1567,17071,2013,Sunderland A.F.C. is owned by <extra_id_0>.,<extra_id_0> Ellis Short <extra_id_1>
1568,17082,2013,<extra_id_0> is the head coach of Roubaix Lille Métropole.,<extra_id_0> Francis van Londersele <extra_id_1>
1569,17093,2013,<extra_id_0> is the chair of Party of Italian Communists.,<extra_id_0> Antonino Cuffaro <extra_id_1>
1570,17097,2013,<extra_id_0> is the head coach of CF Fuenlabrada.,<extra_id_0> José María Salmerón <extra_id_1>
1571,17108,2013,Abdullah bin Khalid bin Sultan Al Saud attended <extra_id_0>.,<extra_id_0> MIT Sloan School of Management <extra_id_1>
1572,17114,2013,Fabián Caballero plays for <extra_id_0>.,<extra_id_0> Sportivo Ameliano <extra_id_1>
1573,17119,2013,Nick Clegg holds the position of <extra_id_0>.,<extra_id_0> Deputy Prime Minister of the United Kingdom <extra_id_1>
1574,17125,2013,Dries Mertens plays for <extra_id_0>.,<extra_id_0> Belgium national football team <extra_id_1>
1575,17134,2013,<extra_id_0> is the head coach of De Graafschap.,<extra_id_0> Pieter Huistra <extra_id_1>
1576,17140,2013,Laila Davidsen is a member of the <extra_id_0>.,<extra_id_0> Conservative Party of Norway <extra_id_1>
1577,17151,2013,<extra_id_0> is the chair of Christian Social Union of Bavaria.,<extra_id_0> Horst Seehofer <extra_id_1>
1578,17162,2013,Xavier Trias is a member of the <extra_id_0>.,<extra_id_0> Democratic Convergence of Catalonia <extra_id_1>
1579,17170,2013,<extra_id_0> is the chair of Haut Conseil des finances publiques.,<extra_id_0> Didier Migaud <extra_id_1>
1580,17181,2013,Paulo Fonseca works for <extra_id_0>.,<extra_id_0> F.C. Paços de Ferreira <extra_id_1>
1581,17186,2013,Eduardo da Silva plays for <extra_id_0>.,<extra_id_0> Croatia national association football team <extra_id_1>
1582,17204,2013,Christophe Robino is a member of the <extra_id_0>.,<extra_id_0> Horizon Monaco <extra_id_1>
1583,17215,2013,Luol Deng plays for <extra_id_0>.,<extra_id_0> Chicago Bulls <extra_id_1>
1584,17222,2013,Daniel J. Myers works for <extra_id_0>.,<extra_id_0> University of Notre Dame <extra_id_1>
1585,17233,2013,Frank Lampard plays for <extra_id_0>.,<extra_id_0> England national association football team <extra_id_1>
1586,17237,2013,Pietro Grasso is a member of the <extra_id_0>.,<extra_id_0> Democratic Party <extra_id_1>
1587,17248,2013,Martin Ferguson holds the position of <extra_id_0>.,<extra_id_0> Minister for Foreign Affairs <extra_id_1>
1588,17252,2013,Serdar Tasci plays for <extra_id_0>.,<extra_id_0> Spartak Moscow <extra_id_1>
1589,17259,2013,50Hertz Transmission is owned by <extra_id_0>.,<extra_id_0> Elia <extra_id_1>
1590,17267,2013,Ashleigh Barty plays for <extra_id_0>.,<extra_id_0> Australia Fed Cup team <extra_id_1>
1591,17285,2013,Duracell is owned by <extra_id_0>.,<extra_id_0> Procter & Gamble <extra_id_1>
1592,17296,2013,MS Brilliance of the Seas is owned by <extra_id_0>.,<extra_id_0> Lloyds Banking Group <extra_id_1>
1593,17305,2013,<extra_id_0> is the head coach of Palermo FC.,<extra_id_0> Gennaro Gattuso <extra_id_1>
1594,17310,2013,Ellen Weiss works for <extra_id_0>.,<extra_id_0> E. W. Scripps Company <extra_id_1>
1595,17321,2013,<extra_id_0> is the head of the government of Seoul.,<extra_id_0> Park Won-soon <extra_id_1>
1596,17340,2013,Diana Coben works for <extra_id_0>.,<extra_id_0> University of Waikato <extra_id_1>
1597,17349,2013,Carson Wentz plays for <extra_id_0>.,<extra_id_0> North Dakota State Bison football <extra_id_1>
1598,17360,2013,Carson Wentz attended <extra_id_0>.,<extra_id_0> North Dakota State University <extra_id_1>
1599,17367,2013,Benoit Dorais is a member of the <extra_id_0>.,<extra_id_0> Vision Montreal <extra_id_1>
1600,17380,2013,Lois Frankel holds the position of <extra_id_0>.,<extra_id_0> United States representative <extra_id_1>
1601,17393,2013,<extra_id_0> is the chair of FC Girondins de Bordeaux.,<extra_id_0> Jean-Louis Triaud <extra_id_1>
1602,17404,2013,Bill Cassidy holds the position of <extra_id_0>.,<extra_id_0> United States representative <extra_id_1>
1603,17415,2013,<extra_id_0> is the head coach of Hallescher FC.,<extra_id_0> Sven Köhler <extra_id_1>
1604,17424,2013,Rupert Sutherland works for <extra_id_0>.,<extra_id_0> GNS Science <extra_id_1>
1605,17434,2013,Martina Anderson holds the position of <extra_id_0>.,<extra_id_0> member of the European Parliament <extra_id_1>
1606,17444,2013,<extra_id_0> is the head coach of Bologna FC 1909.,<extra_id_0> Stefano Pioli <extra_id_1>
1607,17452,2013,Nicola Sturgeon holds the position of <extra_id_0>.,<extra_id_0> Deputy First Minister of Scotland <extra_id_1>
1608,17464,2013,Josep Lluís Alay Rodríguez works for <extra_id_0>.,<extra_id_0> Barcelona City Council <extra_id_1>
1609,17475,2013,Vernon Tava is a member of the <extra_id_0>.,<extra_id_0> Green Party of Aotearoa New Zealand <extra_id_1>
1610,17485,2013,Ian Murdock works for <extra_id_0>.,<extra_id_0> Salesforce Marketing Cloud <extra_id_1>
1611,17505,2013,Steven Croft holds the position of <extra_id_0>.,<extra_id_0> Bishop of Sheffield <extra_id_1>
1612,17516,2013,Ivan Štefanec is a member of the <extra_id_0>.,<extra_id_0> Slovak Democratic and Christian Union – Democratic Party <extra_id_1>
1613,17527,2013,TV 2 Group is owned by <extra_id_0>.,<extra_id_0> Egmont <extra_id_1>
1614,17538,2013,National Geographic Partners is owned by <extra_id_0>.,<extra_id_0> 21st Century Fox <extra_id_1>
1615,17549,2013,Robert W. McElroy holds the position of <extra_id_0>.,<extra_id_0> auxiliary bishop <extra_id_1>
1616,17560,2013,Y. S. Jaganmohan Reddy is a member of the <extra_id_0>.,<extra_id_0> YSR Congress Party <extra_id_1>
1617,17571,2013,Sergio Romero plays for <extra_id_0>.,<extra_id_0> AS Monaco FC <extra_id_1>
1618,17582,2013,Motohiro Ōno is a member of the <extra_id_0>.,<extra_id_0> Democratic Party of Japan <extra_id_1>
1619,17592,2013,Jan Vertonghen plays for <extra_id_0>.,<extra_id_0> Tottenham Hotspur F.C. <extra_id_1>
1620,17603,2013,Ole M. Sejersted works for <extra_id_0>.,<extra_id_0> University of Oslo <extra_id_1>
1621,17614,2013,<extra_id_0> is the chair of Alliance of Small Island States.,<extra_id_0> Marlene Moses <extra_id_1>
1622,17625,2013,Anna Soubry is a member of the <extra_id_0>.,<extra_id_0> Conservative Party <extra_id_1>
1623,17636,2013,Floyd Shivambu is a member of the <extra_id_0>.,<extra_id_0> Economic Freedom Fighters <extra_id_1>
1624,17647,2013,<extra_id_0> is the head coach of Tampa Bay Rowdies.,<extra_id_0> Ricky Hill <extra_id_1>
1625,17658,2013,Suzan DelBene holds the position of <extra_id_0>.,<extra_id_0> United States representative <extra_id_1>
1626,17671,2013,Leonore Gewessler works for <extra_id_0>.,<extra_id_0> Green European Foundation <extra_id_1>
1627,17677,2013,<extra_id_0> is the head of the government of Amstelveen.,<extra_id_0> Jan van Zanen <extra_id_1>
1628,17686,2013,"<extra_id_0> is the chair of Tesla, Inc..",<extra_id_0> Elon Musk <extra_id_1>
1629,17697,2013,Mitchell Johnson plays for <extra_id_0>.,<extra_id_0> Australia national cricket team <extra_id_1>
1630,17704,2013,Alistair Carmichael holds the position of <extra_id_0>.,<extra_id_0> Secretary of State for Scotland <extra_id_1>
1631,17715,2013,Gianluca Zambrotta plays for <extra_id_0>.,<extra_id_0> FC Chiasso <extra_id_1>
1632,17720,2013,Dimitar Stoyanov is a member of the <extra_id_0>.,<extra_id_0> National-Democratic Party <extra_id_1>
1633,17731,2013,Raúl Castro Ruz holds the position of <extra_id_0>.,<extra_id_0> Prime Minister of Cuba <extra_id_1>
1634,17740,2013,Stephen Robson holds the position of <extra_id_0>.,<extra_id_0> auxiliary bishop <extra_id_1>
1635,17751,2013,Blase J. Cupich holds the position of <extra_id_0>.,<extra_id_0> diocesan bishop <extra_id_1>
1636,17765,2013,<extra_id_0> is the head of the government of Munich.,<extra_id_0> Christian Ude <extra_id_1>
1637,17776,2013,Paul O'Connell plays for <extra_id_0>.,<extra_id_0> British & Irish Lions <extra_id_1>
1638,17787,2013,Scott Peters holds the position of <extra_id_0>.,<extra_id_0> United States representative <extra_id_1>
1639,17798,2013,Nicola Giorgino is a member of the <extra_id_0>.,<extra_id_0> The People of Freedom <extra_id_1>
1640,17809,2013,Ryan Arcidiacono attended <extra_id_0>.,<extra_id_0> Villanova University <extra_id_1>
