index,original,date,input,output
2339,25530,2013,<extra_id_0> is the chair of European Trade Union Confederation.,<extra_id_0> Ignacio Fernández Toxo <extra_id_1>
2340,25535,2013,<extra_id_0> is the head of the government of Connecticut.,<extra_id_0> Dannel Malloy <extra_id_1>
2341,25552,2013,<extra_id_0> is the head of the government of Free Hanseatic City of Bremen.,<extra_id_0> Jens Böhrnsen <extra_id_1>
2342,25563,2013,Frank Sinclair plays for <extra_id_0>.,<extra_id_0> Colwyn Bay F.C. <extra_id_1>
2343,25569,2013,<extra_id_0> is the head coach of Florida Gators women's basketball.,<extra_id_0> Amanda Butler <extra_id_1>
2344,25584,2013,Aaron Johanson is a member of the <extra_id_0>.,<extra_id_0> Republican Party <extra_id_1>
2345,25595,2013,<extra_id_0> is the head of the government of Sector 1.,<extra_id_0> Andrei Chiliman <extra_id_1>
2346,25601,2013,<extra_id_0> is the chair of World Bank.,<extra_id_0> Jim Yong Kim <extra_id_1>
2347,25612,2013,<extra_id_0> is the chair of Security Service of Ukraine.,<extra_id_0> Igor Kalinin <extra_id_1>
2348,25623,2013,Stephanie Stebich works for <extra_id_0>.,<extra_id_0> Tacoma Art Museum <extra_id_1>
2349,25634,2013,Mark Cavendish plays for <extra_id_0>.,<extra_id_0> Deceuninck-Quick-Step <extra_id_1>
2350,25645,2013,Daniel Boeri is a member of the <extra_id_0>.,<extra_id_0> Horizon Monaco <extra_id_1>
2351,25653,2013,Ben Stokes plays for <extra_id_0>.,<extra_id_0> England and Wales cricket team <extra_id_1>
2352,25664,2013,Mario Balotelli plays for <extra_id_0>.,<extra_id_0> Associazione Calcio Milan <extra_id_1>
2353,25675,2013,<extra_id_0> is the chair of Universal Esperanto Association.,<extra_id_0> Probal Dasgupta <extra_id_1>
2354,25685,2013,Grete Faremo holds the position of <extra_id_0>.,<extra_id_0> Minister of Justice and Public Security <extra_id_1>
2355,25693,2013,<extra_id_0> is the chair of Vinmonopolet.,<extra_id_0> Hill-Marta Solberg <extra_id_1>
2356,25704,2013,Anba Epiphanius holds the position of <extra_id_0>.,<extra_id_0> bishop <extra_id_1>
2357,25710,2013,Warren Truss holds the position of <extra_id_0>.,<extra_id_0> Minister for Infrastructure and Transport <extra_id_1>
2358,25721,2013,Franziska Brantner holds the position of <extra_id_0>.,<extra_id_0> member of the European Parliament <extra_id_1>
2359,25729,2013,Juan Cuadrado plays for <extra_id_0>.,<extra_id_0> ACF Fiorentina <extra_id_1>
2360,25751,2013,Laurence Boone works for <extra_id_0>.,<extra_id_0> Bank of America <extra_id_1>
2361,25761,2013,Ewa Paluch works for <extra_id_0>.,<extra_id_0> University College London <extra_id_1>
2362,25772,2013,Thawte Consulting is owned by <extra_id_0>.,<extra_id_0> NortonLifeLock <extra_id_1>
2363,25783,2013,Meritxell Budó i Pla is a member of the <extra_id_0>.,<extra_id_0> Democratic Convergence of Catalonia <extra_id_1>
2364,25794,2013,Sagiri Kitao works for <extra_id_0>.,<extra_id_0> City University of New York <extra_id_1>
2365,25805,2013,<extra_id_0> is the chair of Humanist Democratic Centre.,<extra_id_0> Benoît Lutgen <extra_id_1>
2366,25815,2013,Courtney Ekmark attended <extra_id_0>.,<extra_id_0> St. Mary's Catholic High School <extra_id_1>
2367,25832,2013,Missy Franklin attended <extra_id_0>.,<extra_id_0> Regis Jesuit High School <extra_id_1>
2368,25856,2013,Barry O'Farrell holds the position of <extra_id_0>.,<extra_id_0> Premier of New South Wales <extra_id_1>
2369,25861,2013,Mateo Kovačić plays for <extra_id_0>.,<extra_id_0> Croatia national association football team <extra_id_1>
2370,25879,2013,Meråker Line is owned by <extra_id_0>.,<extra_id_0> Norwegian National Rail Administration <extra_id_1>
2371,25887,2013,Jan Piotrowski holds the position of <extra_id_0>.,<extra_id_0> auxiliary bishop <extra_id_1>
2372,25898,2013,<extra_id_0> is the head of the government of Vitré Communauté.,<extra_id_0> Pierre Méhaignerie <extra_id_1>
2373,25907,2013,Parvez Elahi holds the position of <extra_id_0>.,<extra_id_0> Deputy Prime Minister of Pakistan <extra_id_1>
2374,25914,2013,<extra_id_0> is the head of the government of Chelyabinsk Oblast.,<extra_id_0> Mikhail Yurevich <extra_id_1>
2375,25924,2013,Hana Hasanah Shahab is a member of the <extra_id_0>.,<extra_id_0> Indonesian Democratic Party – Struggle <extra_id_1>
2376,25935,2013,Whitney Engen plays for <extra_id_0>.,<extra_id_0> Tyresö FF <extra_id_1>
2377,25946,2013,Politico Europe is owned by <extra_id_0>.,<extra_id_0> Economist Group <extra_id_1>
2378,25957,2013,David Dabede Mabuza holds the position of <extra_id_0>.,<extra_id_0> Premier of Mpumalanga <extra_id_1>
2379,25968,2013,<extra_id_0> is the chair of Libertarian Party.,<extra_id_0> Geoff Neale <extra_id_1>
2380,25983,2013,Vilja Toomast is a member of the <extra_id_0>.,<extra_id_0> Estonian Reform Party <extra_id_1>
2381,25994,2013,Alan J. Russell works for <extra_id_0>.,<extra_id_0> Carnegie Mellon University <extra_id_1>
2382,26005,2013,Meise Botanic Garden is owned by <extra_id_0>.,<extra_id_0> Belgium <extra_id_1>
2383,26016,2013,Sam Brownback holds the position of <extra_id_0>.,<extra_id_0> Governor of Kansas <extra_id_1>
2384,26032,2013,t-online.de is owned by <extra_id_0>.,<extra_id_0> Deutsche Telekom <extra_id_1>
2385,26042,2013,Mark Leonard Bartchak holds the position of <extra_id_0>.,<extra_id_0> diocesan bishop <extra_id_1>
2386,26053,2013,<extra_id_0> is the head coach of BK Häcken.,<extra_id_0> Peter Gerhardsson <extra_id_1>
2387,26063,2013,Eamon Gilmore holds the position of <extra_id_0>.,<extra_id_0> Tánaiste <extra_id_1>
2388,26072,2013,Rod Richards is a member of the <extra_id_0>.,<extra_id_0> Conservative Party <extra_id_1>
2389,26087,2013,Neil Abercrombie holds the position of <extra_id_0>.,<extra_id_0> Governor of Hawaii <extra_id_1>
2390,26092,2013,<extra_id_0> is the chair of Inuit Ataqatigiit.,<extra_id_0> Kuupik Kleist <extra_id_1>
2391,26103,2013,Carson Pickett attended <extra_id_0>.,<extra_id_0> Florida State University <extra_id_1>
2392,26110,2013,Rane Willerslev works for <extra_id_0>.,<extra_id_0> University of Oslo <extra_id_1>
2393,26121,2013,Clinton Morrison plays for <extra_id_0>.,<extra_id_0> Colchester United F.C. <extra_id_1>
2394,26126,2013,Jean-Michel Oughourlian works for <extra_id_0>.,<extra_id_0> American Hospital of Paris <extra_id_1>
2395,26131,2013,Marine Le Pen holds the position of <extra_id_0>.,<extra_id_0> member of the European Parliament <extra_id_1>
2396,26139,2013,Malala Yousafzai attended <extra_id_0>.,<extra_id_0> Edgbaston High School <extra_id_1>
2397,26152,2013,<extra_id_0> is the chair of Left Alliance.,<extra_id_0> Paavo Arhinmäki <extra_id_1>
2398,26163,2013,Jacques Kallis plays for <extra_id_0>.,<extra_id_0> South Africa national cricket team <extra_id_1>
2399,26169,2013,<extra_id_0> is the chair of Unilever.,<extra_id_0> Michael Treschow <extra_id_1>
2400,26179,2013,Linda Collins-Smith is a member of the <extra_id_0>.,<extra_id_0> Republican Party <extra_id_1>
2401,26190,2013,Derek Willis attended <extra_id_0>.,<extra_id_0> Bullitt East High School <extra_id_1>
2402,26198,2013,<extra_id_0> is the chair of French National Assembly.,<extra_id_0> Claude Bartolone <extra_id_1>
2403,26209,2013,David Benton works for <extra_id_0>.,<extra_id_0> International Council of Nurses <extra_id_1>
2404,26220,2013,<extra_id_0> is the chair of Aston Villa F.C..,<extra_id_0> Xia Jiantong <extra_id_1>
2405,26238,2013,Aston Villa F.C. is owned by <extra_id_0>.,<extra_id_0> Xia Jiantong <extra_id_1>
2406,26249,2013,Zaharije Trnavčević is a member of the <extra_id_0>.,<extra_id_0> Rich Serbia <extra_id_1>
2407,26263,2013,Ayelet Shaked is a member of the <extra_id_0>.,<extra_id_0> The Jewish Home <extra_id_1>
2408,26279,2013,Li Keqiang holds the position of <extra_id_0>.,<extra_id_0> Premier of the State Council of the People's Republic of China <extra_id_1>
2409,26290,2013,James Marape is a member of the <extra_id_0>.,<extra_id_0> People's National Congress Party <extra_id_1>
2410,26301,2013,Márta V. Naszályi is a member of the <extra_id_0>.,<extra_id_0> Politics Can Be Different <extra_id_1>
2411,26312,2013,Barbara Wohlmuth works for <extra_id_0>.,<extra_id_0> Technical University of Munich <extra_id_1>
2412,26327,2013,Nicolas Ghesquière works for <extra_id_0>.,<extra_id_0> Louis Vuitton <extra_id_1>
2413,26343,2013,Giorgos Provopoulos works for <extra_id_0>.,<extra_id_0> Bank of Greece <extra_id_1>
2414,26354,2013,Asmir Begović plays for <extra_id_0>.,<extra_id_0> Stoke City F.C. <extra_id_1>
2415,26365,2013,<extra_id_0> is the head coach of FK Rad.,<extra_id_0> Marko Nikolić <extra_id_1>
2416,26377,2013,Maicer Izturis works for <extra_id_0>.,<extra_id_0> Toronto Blue Jays <extra_id_1>
2417,26384,2013,Rizzoli Libri is owned by <extra_id_0>.,<extra_id_0> RCS MediaGroup <extra_id_1>
2418,26395,2013,Maria Tolppanen is a member of the <extra_id_0>.,<extra_id_0> Finns Party <extra_id_1>
2419,26404,2013,<extra_id_0> is the head coach of Liverpool F.C..,<extra_id_0> Brendan Rodgers <extra_id_1>
2420,26415,2013,Jada Benn Torres works for <extra_id_0>.,<extra_id_0> University of Notre Dame <extra_id_1>
2421,26426,2013,Ki Sung-yueng plays for <extra_id_0>.,<extra_id_0> Swansea City A.F.C. <extra_id_1>
2422,26431,2013,Teddy Chevalier plays for <extra_id_0>.,<extra_id_0> K.V. Kortrijk <extra_id_1>
2423,26442,2013,Kaleemullah Khan plays for <extra_id_0>.,<extra_id_0> Pakistan national football team <extra_id_1>
2424,26457,2013,Jennison Myrie-Williams plays for <extra_id_0>.,<extra_id_0> Port Vale F.C. <extra_id_1>
2425,26466,2013,Božidar Delić is a member of the <extra_id_0>.,<extra_id_0> Serbian Radical Party <extra_id_1>
2426,26484,2013,<extra_id_0> is the head coach of FC Krasnodar.,<extra_id_0> Slavoljub Muslin <extra_id_1>
2427,26491,2013,<extra_id_0> is the head of the government of Nur-Sultan.,<extra_id_0> Imangali Tasmagambetov <extra_id_1>
2428,26502,2013,Ovidiu Silaghi is a member of the <extra_id_0>.,<extra_id_0> National Liberal Party <extra_id_1>
2429,26513,2013,Patrick O'Flynn is a member of the <extra_id_0>.,<extra_id_0> UK Independence Party <extra_id_1>
2430,26524,2013,Marios Matsakis is a member of the <extra_id_0>.,<extra_id_0> independent politician <extra_id_1>
2431,26535,2013,Micah Richards plays for <extra_id_0>.,<extra_id_0> Manchester City F.C. <extra_id_1>
2432,26557,2013,Niels Provos works for <extra_id_0>.,<extra_id_0> Google <extra_id_1>
2433,26568,2013,<extra_id_0> is the chair of European People's Party group.,<extra_id_0> Joseph Daul <extra_id_1>
2434,26579,2013,<extra_id_0> is the head of the government of Caen.,<extra_id_0> Philippe Duron <extra_id_1>
2435,26589,2013,Michael Woodley works for <extra_id_0>.,<extra_id_0> Umeå University <extra_id_1>
2436,26616,2013,<extra_id_0> is the head of the government of Ukraine.,<extra_id_0> Mykola Azarov <extra_id_1>
2437,26624,2013,<extra_id_0> is the head coach of R. Charleroi S.C..,<extra_id_0> Felice Mazzu <extra_id_1>
2438,26634,2013,Emily Thornberry holds the position of <extra_id_0>.,<extra_id_0> Shadow Attorney General for England and Wales <extra_id_1>
2439,26644,2013,S. Olvah Alhamid attended <extra_id_0>.,<extra_id_0> University of Groningen <extra_id_1>
2440,26651,2013,<extra_id_0> is the head coach of AG2R La Mondiale.,<extra_id_0> Stéphane Goubert <extra_id_1>
2441,26662,2013,Jeff Sessions holds the position of <extra_id_0>.,<extra_id_0> United States senator <extra_id_1>
2442,26672,2013,Robbie Keane plays for <extra_id_0>.,<extra_id_0> Los Angeles Galaxy <extra_id_1>
2443,26681,2013,Alexandra Arce is a member of the <extra_id_0>.,<extra_id_0> PAIS Alliance <extra_id_1>
2444,26691,2013,Nikki Haley holds the position of <extra_id_0>.,<extra_id_0> Governor of South Carolina <extra_id_1>
2445,26700,2013,Cindy Moehring works for <extra_id_0>.,<extra_id_0> Walmart <extra_id_1>
2446,26711,2013,Harry Kane plays for <extra_id_0>.,<extra_id_0> Leicester City F.C. <extra_id_1>
2447,26722,2013,Anchorage Daily News is owned by <extra_id_0>.,<extra_id_0> The McClatchy Company <extra_id_1>
2448,26733,2013,Oleksandr Vilkul is a member of the <extra_id_0>.,<extra_id_0> Party of Regions <extra_id_1>
2449,26744,2013,<extra_id_0> is the head of the government of Saxony.,<extra_id_0> Stanislaw Tillich <extra_id_1>
2450,26755,2013,<extra_id_0> is the head coach of Germany women's national football team.,<extra_id_0> Silvia Neid <extra_id_1>
2451,26772,2013,<extra_id_0> is the chair of Deutsche Physikalische Gesellschaft.,<extra_id_0> Johanna Stachel <extra_id_1>
2452,26780,2013,<extra_id_0> is the head coach of Kristiansund BK.,<extra_id_0> Geir Bakke <extra_id_1>
2453,26791,2013,Adam Gilchrist plays for <extra_id_0>.,<extra_id_0> Kings XI Punjab <extra_id_1>
2454,26795,2013,Maurice Jones-Drew plays for <extra_id_0>.,<extra_id_0> Jacksonville Jaguars <extra_id_1>
2455,26806,2013,Scott Manley works for <extra_id_0>.,<extra_id_0> Apple Inc. <extra_id_1>
2456,26817,2013,<extra_id_0> is the head coach of FC Bayern Munich.,<extra_id_0> Jupp Heynckes <extra_id_1>
2457,26832,2013,Monty Panesar plays for <extra_id_0>.,<extra_id_0> Sussex County Cricket Club <extra_id_1>
2458,26838,2013,Kalani Brown attended <extra_id_0>.,<extra_id_0> Salmen High School <extra_id_1>
2459,26848,2013,Katherine Boyer attended <extra_id_0>.,<extra_id_0> University of Manitoba <extra_id_1>
2460,26857,2013,Land Rover is owned by <extra_id_0>.,<extra_id_0> Jaguar Land Rover <extra_id_1>
2461,26868,2013,Alpha Condé holds the position of <extra_id_0>.,<extra_id_0> President of Guinea <extra_id_1>
2462,26878,2013,Roger Penrose works for <extra_id_0>.,<extra_id_0> Leiden University <extra_id_1>
2463,26889,2013,Henryk Broder works for <extra_id_0>.,<extra_id_0> Welt am Sonntag <extra_id_1>
2464,26900,2013,Leonardo Bonucci plays for <extra_id_0>.,<extra_id_0> Juventus FC <extra_id_1>
2465,26911,2013,<extra_id_0> is the chair of National Party of Australia.,<extra_id_0> Warren Truss <extra_id_1>
2466,26920,2013,Elazar Stern is a member of the <extra_id_0>.,<extra_id_0> Hatnuah <extra_id_1>
2467,26931,2013,Hitoshi Goto is a member of the <extra_id_0>.,<extra_id_0> Democratic Party of Japan <extra_id_1>
2468,26942,2013,Winston Reid plays for <extra_id_0>.,<extra_id_0> West Ham United F.C. <extra_id_1>
2469,26953,2013,José Évrard is a member of the <extra_id_0>.,<extra_id_0> French Communist Party <extra_id_1>
2470,26963,2013,Katherine Maher works for <extra_id_0>.,<extra_id_0> Access Now <extra_id_1>
2471,26974,2013,Victor Ponta is a member of the <extra_id_0>.,<extra_id_0> Social Democratic Party <extra_id_1>
2472,26989,2013,<extra_id_0> is the chair of House of Representatives.,<extra_id_0> Anouchka van Miltenburg <extra_id_1>
2473,27000,2013,Javier Ferrán works for <extra_id_0>.,<extra_id_0> Lion Capital LLP <extra_id_1>
2474,27015,2013,Christian McCaffrey attended <extra_id_0>.,<extra_id_0> Valor Christian High School <extra_id_1>
2475,27030,2013,<extra_id_0> is the head coach of CCC Team.,<extra_id_0> Yvon Ledanois <extra_id_1>
2476,27041,2013,John Giannandrea works for <extra_id_0>.,<extra_id_0> Google <extra_id_1>
2477,27052,2013,Jamie Roberts plays for <extra_id_0>.,<extra_id_0> Racing 92 <extra_id_1>
2478,27067,2013,Karen Pence holds the position of <extra_id_0>.,<extra_id_0> First Lady <extra_id_1>
2479,27082,2013,Intourist is owned by <extra_id_0>.,<extra_id_0> Sistema <extra_id_1>
2480,27093,2013,Angelo Mathews plays for <extra_id_0>.,<extra_id_0> Sri Lanka national cricket team <extra_id_1>
2481,27102,2013,Marian-Jean Marinescu is a member of the <extra_id_0>.,<extra_id_0> Democratic Liberal Party <extra_id_1>
2482,27113,2013,<extra_id_0> is the head of the government of Yonkers.,<extra_id_0> Mike Spano <extra_id_1>
2483,27124,2013,Márta Demeter is a member of the <extra_id_0>.,<extra_id_0> Hungarian Socialist Party <extra_id_1>
2484,27135,2013,Mercedes Vila Juárez works for <extra_id_0>.,<extra_id_0> Complutense University of Madrid <extra_id_1>
2485,27141,2013,Jim Sensenbrenner holds the position of <extra_id_0>.,<extra_id_0> delegate <extra_id_1>
2486,27150,2013,Benjamin Fung works for <extra_id_0>.,<extra_id_0> Concordia University <extra_id_1>
2487,27161,2013,<extra_id_0> is the head of the government of Atlanta.,<extra_id_0> Kasim Reed <extra_id_1>
2488,27172,2013,<extra_id_0> is the head coach of Poland national association football team.,<extra_id_0> Waldemar Fornalik <extra_id_1>
2489,27180,2013,Michelle Lujan Grisham holds the position of <extra_id_0>.,<extra_id_0> United States representative <extra_id_1>
2490,27191,2013,Steven Naismith plays for <extra_id_0>.,<extra_id_0> Everton F.C. <extra_id_1>
2491,27202,2013,Place Ville Marie is owned by <extra_id_0>.,<extra_id_0> Ivanhoe Cambridge <extra_id_1>
2492,27213,2013,José Mujica holds the position of <extra_id_0>.,<extra_id_0> President of Uruguay <extra_id_1>
2493,27225,2013,<extra_id_0> is the chair of Jamiat Ahle Hadith.,<extra_id_0> Ehsan Elahi Zaheer <extra_id_1>
2494,27236,2013,<extra_id_0> is the chair of easyJet.,<extra_id_0> Sir Michael Rake <extra_id_1>
2495,27247,2013,Jos Buttler plays for <extra_id_0>.,<extra_id_0> Melbourne Renegades <extra_id_1>
2496,27255,2013,Che Adams plays for <extra_id_0>.,<extra_id_0> Ilkeston F.C. <extra_id_1>
2497,27263,2013,<extra_id_0> is the head coach of ASA 2013 Târgu Mureș.,<extra_id_0> Cristian Coroian <extra_id_1>
2498,27272,2013,<extra_id_0> is the head coach of FC Levadia Tallinn.,<extra_id_0> Marko Kristal <extra_id_1>
2499,27279,2013,Malcolm Turnbull holds the position of <extra_id_0>.,"<extra_id_0> Minister for Broadband, Communications and the Digital Economy <extra_id_1>"
2500,27295,2013,<extra_id_0> is the head coach of Los Angeles Galaxy.,<extra_id_0> Bruce Arena <extra_id_1>
2501,27305,2013,<extra_id_0> is the head of the government of Benin.,<extra_id_0> Pascal Koupaki <extra_id_1>
2502,27315,2013,Peter Sagan plays for <extra_id_0>.,<extra_id_0> Cannondale Pro Cycling Team <extra_id_1>
2503,27326,2013,Judith Collins holds the position of <extra_id_0>.,<extra_id_0> Minister of Justice <extra_id_1>
2504,27334,2013,James Jones holds the position of <extra_id_0>.,<extra_id_0> Spokesperson bishops in the Church of England <extra_id_1>
2505,27338,2013,<extra_id_0> is the head of the government of Sherbrooke.,<extra_id_0> Bernard Sévigny <extra_id_1>
2506,27349,2013,Damian Green holds the position of <extra_id_0>.,<extra_id_0> Minister for Policing <extra_id_1>
2507,27359,2013,Ivan Basso plays for <extra_id_0>.,<extra_id_0> Cannondale Pro Cycling Team <extra_id_1>
2508,27365,2013,Richard Bruton holds the position of <extra_id_0>.,<extra_id_0> Teachta Dála <extra_id_1>
2509,27376,2013,Selina Meyer holds the position of <extra_id_0>.,<extra_id_0> Vice President of the United States <extra_id_1>
2510,27383,2013,<extra_id_0> is the head of the government of Ilocos Norte.,<extra_id_0> Imee Marcos <extra_id_1>
2511,27394,2013,<extra_id_0> is the head of the government of Sabah.,<extra_id_0> Musa Aman <extra_id_1>
2512,27402,2013,Avichai Mandelblit holds the position of <extra_id_0>.,<extra_id_0> Cabinet Secretary <extra_id_1>
2513,27413,2013,<extra_id_0> is the chair of Norwegian Parliamentary Intelligence Oversight Committee.,<extra_id_0> Eldbjørg Løwer <extra_id_1>
2514,27426,2013,Pamela Russell works for <extra_id_0>.,<extra_id_0> The University of Queensland <extra_id_1>
2515,27437,2013,<extra_id_0> is the chair of Social Democratic Party of Germany.,<extra_id_0> Sigmar Gabriel <extra_id_1>
2516,27450,2013,Dávid Dorosz is a member of the <extra_id_0>.,<extra_id_0> Politics Can Be Different <extra_id_1>
2517,27460,2013,Shannon Walsh works for <extra_id_0>.,<extra_id_0> University of Johannesburg <extra_id_1>
2518,27471,2013,Mircea Geoană is a member of the <extra_id_0>.,<extra_id_0> Social Democratic Party <extra_id_1>
2519,27484,2013,<extra_id_0> is the head coach of Delfino Pescara 1936.,<extra_id_0> Zdeněk Zeman <extra_id_1>
2520,27493,2013,Cheyna Matthews attended <extra_id_0>.,<extra_id_0> Vanderbilt University <extra_id_1>
2521,27500,2013,Glider Ushñahua is a member of the <extra_id_0>.,<extra_id_0> Popular Action <extra_id_1>
2522,27510,2013,<extra_id_0> is the head of the government of Vermont.,<extra_id_0> Peter Shumlin <extra_id_1>
2523,27521,2013,<extra_id_0> is the head coach of Australia national rugby union team.,<extra_id_0> Robbie Deans <extra_id_1>
2524,27532,2013,<extra_id_0> is the chair of Ministry of Health.,<extra_id_0> Vytenis Andriukaitis <extra_id_1>
2525,27540,2013,<extra_id_0> is the head coach of HŠK Zrinjski Mostar.,<extra_id_0> Branko Karačić <extra_id_1>
2526,27547,2013,Joachim Starbatty is a member of the <extra_id_0>.,<extra_id_0> Alternative for Germany <extra_id_1>
2527,27557,2013,Edgar Davids plays for <extra_id_0>.,<extra_id_0> Barnet F.C. <extra_id_1>
2528,27560,2013,Janak Sapkota works for <extra_id_0>.,<extra_id_0> Adolphe Merkle Institute <extra_id_1>
2529,27575,2013,<extra_id_0> is the head of the government of Sint Maarten.,<extra_id_0> Sarah Wescot-Williams <extra_id_1>
2530,27589,2013,<extra_id_0> is the head of the government of Richmond.,<extra_id_0> Dwight Clinton Jones <extra_id_1>
2531,27600,2013,Lewis Hamilton plays for <extra_id_0>.,<extra_id_0> Mercedes <extra_id_1>
2532,27611,2013,Joram van Klaveren is a member of the <extra_id_0>.,<extra_id_0> Party for Freedom <extra_id_1>
2533,27620,2013,<extra_id_0> is the chair of European Parliament.,<extra_id_0> Martin Schulz <extra_id_1>
2534,27631,2013,Sud de France Arena is owned by <extra_id_0>.,<extra_id_0> Languedoc-Roussillon <extra_id_1>
2535,27642,2013,Monica Macovei is a member of the <extra_id_0>.,<extra_id_0> Democratic Liberal Party <extra_id_1>
2536,27664,2013,Ivanka Trump works for <extra_id_0>.,<extra_id_0> The Trump Organization <extra_id_1>
2537,27683,2013,<extra_id_0> is the head of the government of Montpellier.,<extra_id_0> Hélène Mandroux <extra_id_1>
2538,27694,2013,<extra_id_0> is the head of the government of United Kingdom.,<extra_id_0> David Cameron <extra_id_1>
2539,27705,2013,James Harden plays for <extra_id_0>.,<extra_id_0> Houston Rockets <extra_id_1>
2540,27716,2013,Steven Schumacher plays for <extra_id_0>.,<extra_id_0> Fleetwood Town F.C. <extra_id_1>
2541,27727,2013,<extra_id_0> is the chair of HSBC.,<extra_id_0> Douglas Flint <extra_id_1>
2542,27742,2013,Daniel Adlung plays for <extra_id_0>.,<extra_id_0> TSV 1860 München <extra_id_1>
2543,27753,2013,Havas is owned by <extra_id_0>.,<extra_id_0> Bolloré <extra_id_1>
2544,27764,2013,Lee Jae-myung holds the position of <extra_id_0>.,<extra_id_0> mayor <extra_id_1>
2545,27775,2013,Statue of Robert Milligan is owned by <extra_id_0>.,<extra_id_0> Canal & River Trust <extra_id_1>
2546,27786,2013,Antonis Samaras holds the position of <extra_id_0>.,<extra_id_0> Prime Minister of Greece <extra_id_1>
2547,27791,2013,Hameed Hassan plays for <extra_id_0>.,<extra_id_0> Barisal Bulls <extra_id_1>
2548,27798,2013,Agathon Rwasa is a member of the <extra_id_0>.,<extra_id_0> National Forces of Liberation <extra_id_1>
2549,27809,2013,Heather Cox Richardson works for <extra_id_0>.,<extra_id_0> Boston College <extra_id_1>
2550,27820,2013,<extra_id_0> is the head of the government of Taichung.,<extra_id_0> Jason Hu <extra_id_1>
2551,27831,2013,<extra_id_0> is the chair of Konrad Adenauer Foundation.,<extra_id_0> Hans-Gert Pöttering <extra_id_1>
2552,27842,2013,Rockklassiker is owned by <extra_id_0>.,<extra_id_0> Discovery Communications Nordic <extra_id_1>
2553,27850,2013,Obi Toppin attended <extra_id_0>.,"<extra_id_0> Heritage High School (Palm Bay, Florida) <extra_id_1>"
2554,27871,2013,Mamadou Sakho plays for <extra_id_0>.,<extra_id_0> France national association football team <extra_id_1>
2555,27882,2013,Michael Hussey plays for <extra_id_0>.,<extra_id_0> Australia national cricket team <extra_id_1>
2556,27889,2013,Blaise Matuidi plays for <extra_id_0>.,<extra_id_0> France national association football team <extra_id_1>
2557,27900,2013,Todd Young holds the position of <extra_id_0>.,<extra_id_0> United States representative <extra_id_1>
2558,27911,2013,Manuel Delgado Ruiz is a member of the <extra_id_0>.,<extra_id_0> Party of the Communists of Catalonia <extra_id_1>
2559,27917,2013,Sadiq Khan holds the position of <extra_id_0>.,<extra_id_0> Shadow Secretary of State for Justice <extra_id_1>
2560,27934,2013,Hsu Hsin-ying is a member of the <extra_id_0>.,<extra_id_0> Kuomintang <extra_id_1>
2561,27944,2013,Takumi Minamino plays for <extra_id_0>.,<extra_id_0> Japan national under-20 football team <extra_id_1>
2562,27955,2013,Sam Tomkins plays for <extra_id_0>.,<extra_id_0> Wigan Warriors <extra_id_1>
2563,27974,2013,Delphine Ernotte works for <extra_id_0>.,<extra_id_0> Orange <extra_id_1>
2564,27985,2013,William H. McRaven works for <extra_id_0>.,<extra_id_0> United States Navy <extra_id_1>
2565,28003,2013,Meritxell Borràs i Solé is a member of the <extra_id_0>.,<extra_id_0> Democratic Convergence of Catalonia <extra_id_1>
2566,28012,2013,Maria Miller holds the position of <extra_id_0>.,"<extra_id_0> Secretary of State for Culture, Media and Sport <extra_id_1>"
2567,28017,2013,Ferenc Gyurcsány is a member of the <extra_id_0>.,<extra_id_0> Democratic Coalition <extra_id_1>
2568,28028,2013,Dawn Primarolo holds the position of <extra_id_0>.,<extra_id_0> Chairman of Ways and Means <extra_id_1>
2569,28033,2013,Manuel Knoll works for <extra_id_0>.,<extra_id_0> Carlos III University of Madrid <extra_id_1>
2570,28044,2013,<extra_id_0> is the head of the government of Cluj-Napoca.,<extra_id_0> Emil Boc <extra_id_1>
2571,28055,2013,Brian Mansfield works for <extra_id_0>.,<extra_id_0> USA Today <extra_id_1>
2572,28066,2013,Anne Marie Waters is a member of the <extra_id_0>.,<extra_id_0> Labour Party <extra_id_1>
