0,<extra_id_0> is the head coach of Bnei Sakhnin FC                              ,Amir Turgeman,Igor Shalimov
1,Aleqa Hammond is a member of the<extra_id_0>                                   ,Nunatta Qitornai,United Nations Office for Outer Space Affairs
2,Seiji Maehara is a member of the<extra_id_0>                                   ,independent politician,Constitutional Democratic Party of Japan
3,Yves Pons attended<extra_id_0>                                       ,"University of Tennessee, Knoxville",Université du Québec à Trois-Rivières
4,<extra_id_0> is the head of the government of Capital Region of Denmark                                    ,Sophie Hæstorp Andersen,Jürgen Klinsmann
5,Reuven Rivlin holds the position of<extra_id_0>                                    ,President of Israel,Prime Minister of Israel
6,Jabo Ibehre plays for<extra_id_0>                                      ,Carlisle United F.C.,France national association football team
7,<extra_id_0> is the chair of Young Union                                         ,Tilman Kuban,Yves Vanderhaeghe
8,Saul Dubow works for<extra_id_0>                                        ,University of Cambridge,Ministry of Defence
9,Rothschild is owned by<extra_id_0>                                        ,Hermitage Museum,AMC Theatres
10,<extra_id_0> is the chair of Polymetal International                                       ,Ian Cockerill,Nicola Sturgeon
11,<extra_id_0> is the head coach of Rosenborg BK                                      ,Eirik Horneland,Jürgen Klinsmann
12,Marta Lewicka works for<extra_id_0>                                       ,University of Pittsburgh,Ministry of Defence
13,Cory Gardner holds the position of<extra_id_0>                                       ,United States senator,United States representative
14,<extra_id_0> is the head coach of Girona FC                                      ,Eusebio Sacristán,Pablo Machn
15,<extra_id_0> is the head of the government of Istanbul                                       ,Ekrem İmamoğlu,Ünal Karaman
16,<extra_id_0> is the head coach of AEL Limassol FC                                   ,Dušan Kerkez,Yannis Chavos
17,<extra_id_0> is the head coach of FC Slavia-Mozyr                                 ,Mihail Martsinovich,Igor Shalimov
18,<unk> lvaro Morata plays for<extra_id_0>                                     ,Atlético Madrid,Real Madrid CF
19,Ada Colau is a member of the<extra_id_0>                                    ,Barcelona en Comú,Catalan European Democratic Party
20,Paavo Väyrynen is a member of the<extra_id_0>                               ,Seven Star Movement,Estonian Reform Party
21,László T<unk> kés holds the position of<extra_id_0>                                ,member of the European Parliament,Prime Minister of Hungary
22,Luciana Berger is a member of the<extra_id_0>                                   ,Liberal Democrats,National Liberal Party
23,Christopher Hernandez works for<extra_id_0>                                          ,Cornell University,"Facebook, Inc."
24,Eurostar International Limited is owned by<extra_id_0>                                       ,Hermes Investment Management,SNCF
25,Tobin Heath plays for<extra_id_0>                                        ,Portland Thorns FC,Derby County F.C.
26,Brielle Biermann attended<extra_id_0>                                         ,Georgia State University,Locarno Film Festival
27,<extra_id_0> is the chair of Drasi                                         ,Theodoros Skylakakis,Yves Vanderhaeghe
28,Olivier Giroud plays for<extra_id_0>                                       ,France national association football team,France national association football team
29,Jennifer Bendery works for<extra_id_0>                                         ,HuffPost,The New York Times
30,Roger Watson works for<extra_id_0>                                          ,University of Hull,Vivendi
31,<extra_id_0> is the chair of Max Planck Society                                       ,Martin Stratmann,Michael Ludwig
32,<extra_id_0> is the chair of Vet<unk> vendosje!                                   ,Albin Kurti,Jürgen Klinsmann
33,Peter Crouch plays for<extra_id_0>                                         ,Burnley F.C.,England national association football team
34,Saumitra Khan is a member of the<extra_id_0>                                   ,All India Trinamool Congress,All-Pakistan Muslim League
35,Erin Lavik works for<extra_id_0>                                        ,"University of Maryland, Baltimore County",Ministry of Defence
36,Vitaliy Klitschko holds the position of<extra_id_0>                                   ,Mayor of Kyiv,Prime Minister of Russia
37,Barbara J Anderson works for<extra_id_0>                                        ,Manaaki Whenua – Landcare Research,United States Department of State
38,Jill R Horwitz works for<extra_id_0>                                      ,"University of California, Los Angeles",The New York Times
39,Patrick Sensburg holds the position of<extra_id_0>                                       ,president,United States representative
40,Graham F Medley works for<extra_id_0>                                       ,London School of Hygiene & Tropical Medicine,United States Department of State
41,<extra_id_0> is the head coach of Valur                                        ,Ólafur Jóhannesson,Jürgen Klinsmann
42,<extra_id_0> is the head coach of Gap Connahs Quay FC                             ,Andy Morrison,Mauricio Carlesse
43,<extra_id_0> is the chair of Delta Air Lines                                       ,Frank Blake,Mike Turner
44,Marcelo D<unk> az plays for<extra_id_0>                                      ,Chile national football team,Real Madrid CF
45,Edvald Boasson-Hagen plays for<extra_id_0>                                 ,NTT Pro Cycling Team,Sweden national association football team
46,Gaku Shibasaki plays for<extra_id_0>                                       ,Japan national football team,Japan national football team
47,Qi Lu works for<extra_id_0>                                         ,Baidu,China Media Group
48,Kashif Ahmad is a member of the<extra_id_0>                                    ,The Alternative,Pakistan Tehreek-e-Insaf
49,<extra_id_0> is the chair of Embassy of Ukraine Ottawa                                      ,Andriy Shevchenko,Yuriy Yaromko
50,Nathan Rourke attended<extra_id_0>                                         ,Ohio University,Princeton University
51,Wells Fargo Center is owned by<extra_id_0>                                      ,Ivanhoe Cambridge,Berkshire Hathaway
52,Clemens Fuest works for<extra_id_0>                                      ,Ifo Institut für Wirtschaftsforschung,Ministry of Defence
53,<extra_id_0> is the chair of Federal Emergency Management Agency                                       ,Pete Gaynor,Mike Pence
54,Olav Fykse Tveit holds the position of<extra_id_0>                               ,general secretary,Minister for Foreign Affairs of Norway
55,Curtis Pitt holds the position of<extra_id_0>                                      ,Speaker of the Legislative Assembly of Queensland,United States representative
56,Darren Fletcher plays for<extra_id_0>                                       ,West Bromwich Albion F.C.,England national association football team
57,Maria A Pallante works for<extra_id_0>                                      ,Library of Congress,National Museum of Natural History
58,John Galliano works for<extra_id_0>                                         ,Maison Martin Margiela,The New York Times
59,Carlos Eduardo Marques plays for<extra_id_0>                                       ,Clube Atlético Mineiro,Real Madrid CF
60,Josh Perkins attended<extra_id_0>                                          ,Gonzaga University,Gonzaga University
61,<extra_id_0> is the head coach of FK Austria Wien                                      ,Christian Ilzer,Bruno Lage
62,Arike Ogunbowale attended<extra_id_0>                                      ,University of Notre Dame,University of Oxford
63,Rocky Anderson is a member of the<extra_id_0>                                      ,Justice Party,Republican Party
64,Valentino Rossi plays for<extra_id_0>                                        ,Yamaha Motor Racing,Juventus FC
65,Zlatan Pepemovic plays for<extra_id_0>                                    ,Los Angeles Galaxy,Croatia national association football team
66,Max Hollein works for<extra_id_0>                                        ,Metropolitan Museum of Art,Max Planck Institute for Intelligent Systems
67,<extra_id_0> is the head of the government of Yerevan                                     ,Hayk Marutyan,Yldrrrrrrrr
68,<extra_id_0> is the head of the government of Pennsylvania                                       ,Tom Wolf,Mike Pence
69,Lawrence Thomas Persico holds the position of<extra_id_0>                                     ,diocesan bishop,United States representative
70,<extra_id_0> is the chair of Sainsburys                                      ,Martin Scicluna,Michael McPhillips
71,Chris Hipkins holds the position of<extra_id_0>                                       ,Minister of Education,United States representative
72,<extra_id_0> is the head coach of HC Kometa Brno                                  ,Libor Zábranský,Jaroslav ilhav
73,<extra_id_0> is the chair of National Rally                                        ,Marine Le Pen,Yves Vanderhaeghe
74,Choupette is owned by<extra_id_0>                                        ,Karl Lagerfeld,Berkshire Hathaway
75,<extra_id_0> is the head coach of Swiss national football team                                      ,Vladimir Petković,Mauricio De Polis
76,Mahathir Mohamad is a member of the<extra_id_0>                                 ,Malaysian United Indigenous Party,Malaysian United Indigenous Party
77,<extra_id_0> is the chair of Norwegian Womens Lobby                                     ,Ragnhild Hennum,Annegret Kramp-Karrenbauer
78,Bill Shorten holds the position of<extra_id_0>                                       ,Leader of the Opposition of Australia,United States representative
79,Netscape Communications Corporation is owned by<extra_id_0>                                       ,Verizon,NortonLifeLock
80,<extra_id_0> is the head coach of AFC Ajax                                     ,Erik ten Hag,Ronald Koeman
81,Fred VanVleet plays for<extra_id_0>                                      ,Toronto Raptors,Belgium national football team
82,<extra_id_0> is the head coach of Bursaspor                                      ,Mesut Bakkal,Ünal Karaman
83,Jerzy Buzek holds the position of<extra_id_0>                                    ,member of the European Parliament,President of the Republic of Poland
84,<extra_id_0> is the head coach of Venezia FC                                   ,Alessio Dionisi,Giuseppe Sala
85,Michelle Alexander works for<extra_id_0>                                          ,University of York,United Launch Alliance
86,<extra_id_0> is the head coach of FC Zhetysu                                   ,Dmitriy Ogai,Sergey Yaromko
87,Chris Young plays for<extra_id_0>                                          ,Washington Nationals,England national association football team
88,Erwin Hoffer plays for<extra_id_0>                                        ,Karlsruher SC,Germany national association football team
89,Manuel José Macário do Nascimento Clemente holds the position of<extra_id_0>                          ,Patriarch of Lisbon,President of Brazil
90,Jérôme Boateng plays for<extra_id_0>                                      ,FC Bayern Munich,France national association football team
91,Gwendal Rouillard is a member of the<extra_id_0>                                  ,La République En Marche,The Republicans
92,<extra_id_0> is the chair of Young Liberals                                        ,Konstantin Kuhle,Michael McLintock
93,<extra_id_0> is the head coach of FC Botoșani                                     ,Marius Croitoru,Mircea Rednic
94,<extra_id_0> is the head coach of Valencia CF                                       ,Marcelino García Toral,Ximo Puig
95,John Neely Kennedy holds the position of<extra_id_0>                                     ,United States senator,United States representative
96,<extra_id_0> is the head of the government of Poland                                       ,Mateusz Morawiecki,Jacek Jakowiak
97,Scott Morrison holds the position of<extra_id_0>                                       ,Prime Minister of Australia,United States representative
98,Salomon Kalou plays for<extra_id_0>                                       ,Hertha BSC,France national association football team
99,<extra_id_0> is the head of the government of Livorno                                    ,Filippo Nogarin,Marco Borradori
100,Heather Humphreys holds the position of<extra_id_0>                                    ,Teachta Dála,United States representative
101,Călin Popescu-Tăriceanu is a member of the<extra_id_0>                               ,Alliance of Liberals and Democrats Party (Romania),National Liberal Party
102,Brigitte Boccone-Pagès is a member of the<extra_id_0>                            ,Priorité Monaco,Europe Ecology – The Greens
103,<extra_id_0> is the chair of International Shooting Sport Federation                                      ,Vladimir Lisin,Yves Vanderhaeghe
104,Recep Tayyip Erdo<unk> an holds the position of<extra_id_0>                              ,President of Turkey,Prime Minister of Turkey
105,Giorgia Meloni is a member of the<extra_id_0>                                 ,Brothers of Italy,United Left
106,Carmen Lamela D<unk> az works for<extra_id_0>                                    ,Supreme Court of Spain,Televisión Nacional de Chile
107,Kimbrough Memorial Stadium is owned by<extra_id_0>                                      ,Canyon Independent School District,University of Florida
108,Alma Zadi<unk> is a member of the<extra_id_0>                                   ,NOW – Pilz List,independent politician
109,Jordan Randall Smith works for<extra_id_0>                                        ,Symphony Number One,United States Department of State
110,<extra_id_0> is the head coach of SEG Racing Academy                                      ,Michiel Elijzen,Yves Vanderhaeghe
111,Belinda Johnson works for<extra_id_0>                                        ,Airbnb,United States Department of State
112,Bronwyn Harch works for<extra_id_0>                                       ,The University of Queensland,Ministry of Defence
113,Nathan Law is a member of the<extra_id_0>                                      ,Demosistō,Republican Party
114,Tomi Lahren works for<extra_id_0>                                        ,TheBlaze,Ministry of Defence
115,Franck de Lapersonne is a member of the<extra_id_0>                                 ,The Patriots,The Republicans
116,Brendan Eich holds the position of<extra_id_0>                                      ,chief executive officer,United States representative
117,Julian Smith holds the position of<extra_id_0>                                        ,Parliamentary Secretary to the Treasury,United States representative
118,Amos Yong works for<extra_id_0>                                       ,Fuller Theological Seminary,Ministry of Defence
119,Fratelli Fabbri Editori is owned by<extra_id_0>                                   ,Arnoldo Mondadori Editore,NortonLifeLock
120,<extra_id_0> is the chair of Czech Social Democratic Party                                       ,Milan Chovanec,Jaroslav ilhav
121,T L Taylor works for<extra_id_0>                                       ,Massachusetts Institute of Technology,United States Department of State
122,Charles Michel holds the position of<extra_id_0>                                        ,President of the European Council,United States representative
123,<extra_id_0> is the chair of European Bank for Reconstruction and Development                                    ,Suma Chakrabarti,Igor Bakhtanov
124,<extra_id_0> is the head coach of Atlético Madrid                                     ,Diego Simeone,Santiago Solari
125,James Lankford holds the position of<extra_id_0>                                      ,United States senator,United States representative
126,<extra_id_0> is the head of the government of Turin                                      ,Chiara Appendino,Marco Borradori
127,Christine Sinclair plays for<extra_id_0>                                         ,Portland Thorns FC,Scotland national football team
128,Angelo De Donatis holds the position of<extra_id_0>                                    ,auxiliary bishop,United States representative
129,Wout Brama plays for<extra_id_0>                                        ,PEC Zwolle,Belgium national football team
130,Chesley Sully Sullenberger works for<extra_id_0>                                 ,CBS News,United States Department of State
131,Stephen Powis works for<extra_id_0>                                        ,National Health Service (England),The New York Times
132,Robyn Denholm works for<extra_id_0>                                      ,Telstra,Ministry of Defence
133,PanAmericano is owned by<extra_id_0>                                        ,BTG Pactual,Idilia Foods
134,<extra_id_0> is the head coach of Odds BK                                     ,Dag-Eilev Fagermo,Jürgen Klinsmann
135,John Mensah plays for<extra_id_0>                                       ,Accra Hearts of Oak SC,England national association football team
136,Jole Santelli is a member of the<extra_id_0>                                   ,Forza Italia (2013),United Left
137,<extra_id_0> is the head coach of KS Kamza                                      ,Klodian Duro,lhan asn
138,Masterpiece is owned by<extra_id_0>                                         ,Steven A. Cohen,UNESCO
139,<extra_id_0> is the head coach of Androni Giocattoli-Sidermec                             ,Leonardo Scarselli,Giuseppe De Poli
140,Giuseppe Pisanu is a member of the<extra_id_0>                                 ,Civic Choice,Forza Italia (2013)
141,Euclid Tsakalotos works for<extra_id_0>                                   ,National and Kapodistrian University of Athens,University of Oxford
142,Mariló Montero works for<extra_id_0>                                      ,Antena 3,Televisión Nacional de Chile
143,Conor Murray plays for<extra_id_0>                                         ,Munster Rugby,Scotland national football team
144,<extra_id_0> is the chair of National Electoral Council of Venezuela                                    ,Tibisay Lucena,Nicolás Maduro
145,<extra_id_0> is the head coach of Racing Club                                        ,Eduardo  Coudet,Xavier Bettel
146,Poul Michelsen is a member of the<extra_id_0>                                   ,Progress,Conservative Party of Norway
147,Joel Byrom plays for<extra_id_0>                                         ,Northampton Town F.C.,FC Akhmat Grozny
148,4chan is owned by<extra_id_0>                                         ,Hiroyuki Nishimura,Apple Inc.
149,Chris Lewington plays for<extra_id_0>                                        ,Margate F.C.,England national association football team
150,Tuomas Eerola works for<extra_id_0>                                     ,Durham University,Estonian Literary Museum
151,<extra_id_0> is the chair of Christian Social Peoples Party                                     ,Frank Engel,Jürgen Klinsmann
152,<extra_id_0> is the head coach of Unione Sportiva Lecce                                   ,Fabio Liverani,Giuseppe Sala
153,Keith Olbermann works for<extra_id_0>                                        ,ESPN,University of Oxford
154,Juice Robinson works for<extra_id_0>                                         ,New Japan Pro-Wrestling,The New York Times
155,Rabbit is owned by<extra_id_0>                                         ,Steven A. Cohen,Berkshire Hathaway
156,When Will You Marry? is owned by<extra_id_0>                                     ,Al-Mayassa bint Hamad bin Khalifa Al-Thani,Berkshire Hathaway
157,Sharon R Lewin works for<extra_id_0>                                       ,Monash University,United States Department of State
158,Frank-Walter Steinmeier holds the position of<extra_id_0>                                   ,president of Germany,United States representative
159,<extra_id_0> is the head coach of FC Argeș                                      ,Ionuț Badea,Mircea Rednic
160,Melanie Keen works for<extra_id_0>                                         ,Iniva,University of Oxford
161,<extra_id_0> is the head coach of AS Nancy-Lorraine                                ,Jean-Louis Garcia,Jean-Michel Lapin
162,<extra_id_0> is the head of the government of Saint Petersburg                                      ,Alexander Beglov,Sergey Yaromko
163,<extra_id_0> is the head coach of FK Budu<unk> nost Podgorica                               ,Mladen Milinković,Igor Kovalevich
164,Tom Cotton holds the position of<extra_id_0>                                        ,United States senator,United States representative
165,Chris Porter plays for<extra_id_0>                                          ,Colchester United F.C.,England national association football team
166,<extra_id_0> is the head of the government of Ky<unk> to Prefecture                                  ,Takatoshi Nishiwaki,Shinz Abe
167,Norbert Perrimon works for<extra_id_0>                                       ,Harvard University,Ministry of Defence
168,<extra_id_0> is the chair of European Research Council                                        ,Jean-Pierre Bourguignon,Nicola Sturgeon
169,Joakim Noah plays for<extra_id_0>                                        ,New York Knicks,FC Akhmat Grozny
170,Tim Bresnan plays for<extra_id_0>                                       ,Sylhet Sixers,England national association football team
171,Julio Arca plays for<extra_id_0>                                        ,South Shields F.C.,Real Madrid CF
172,Alex Morgan plays for<extra_id_0>                                          ,United States women's national soccer team,England national association football team
173,Pierre-Emerick Aubameyang plays for<extra_id_0>                                  ,Arsenal F.C.,France national association football team
174,Philip W Kantoff works for<extra_id_0>                                      ,Memorial Sloan Kettering Cancer Center,United States Department of State
175,Brenda L Bloodgood works for<extra_id_0>                                        ,"University of California, San Diego",United States Department of State
176,Joana Ortega i Alemany is a member of the<extra_id_0>                               ,Catalan European Democratic Party,Catalan European Democratic Party
177,<extra_id_0> is the head of the government of Batangas                                    ,Hermilando Mandanas,Xavier University of Madrid
178,Kevitsa mine is owned by<extra_id_0>                                      ,Boliden AB,Ministry of Defence
179,Zury R<unk> os is a member of the<extra_id_0>                                  ,Valor (political party),Catalan European Democratic Party
180,Carles Puigdemont holds the position of<extra_id_0>                                   ,member of the European Parliament,President of the European Council
181,Carles Puigdemont is a member of the<extra_id_0>                                 ,Catalan European Democratic Party,The Republicans
182,Karolin Luger works for<extra_id_0>                                        ,University of Colorado Boulder,Ministry of Defence
183,<extra_id_0> is the chair of TOP 09                                         ,Jiří Pospíšil,Yves Vanderhaeghe
184,<extra_id_0> is the head coach of Aerostar Bacău                                     ,Florin Bratu,Ionuț Popa
185,Ruffin McNeill works for<extra_id_0>                                        ,Virginia Cavaliers football,United States Department of State
186,Mazie Hirono holds the position of<extra_id_0>                                     ,United States senator,United States representative
187,Lamar Alexander holds the position of<extra_id_0>                                       ,United States senator,United States representative
188,James Rodr<unk> guez plays for<extra_id_0>                                      ,Real Madrid CF,Mexico national football team
189,<extra_id_0> is the head coach of Telenet-Fidea                                    ,Sven Vanthourenhout,Mauricio Pochettino
190,Reyahn King works for<extra_id_0>                                        ,York Museums Trust,Ministry of Defence
191,Yossi Benayoun plays for<extra_id_0>                                    ,Maccabi Haifa F.C.,FC Akhmat Grozny
192,<extra_id_0> is the chair of Verkhovna Rada                                    ,Dmytro Oleksandrovych Razumkov,Oleksiy Yaromko
193,<extra_id_0> is the head of the government of Basse-Terre                                  ,Marie-Luce Penchard,Jean-Michel Lapin
194,Dragoș Pîslaru is a member of the<extra_id_0>                               ,"Liberty, Unity and Solidarity Party",National Liberal Party
195,Jordan Nwora attended<extra_id_0>                                        ,University of Louisville,Georgetown University
196,<extra_id_0> is the chair of Gibraltar Socialist Labour Party                                    ,Fabian Picardo,Nicola Sturgeon
197,Gennady Gudkov is a member of the<extra_id_0>                                ,Russian Opposition Coordination Council,Yuriy Kuchuk
