0,<extra_id_0> is the head coach of Bnei Sakhnin FC                              ,Amir Turgeman,Igor Shalimov
198,<extra_id_0> is the head of the government of S<unk> o Paulo                                   ,Bruno Covas,José Mara Fernández
199,<extra_id_0> is the head of the government of S<unk> o Paulo                                   ,João Doria Júnior,José Mara Fernández
200,Rathika Sitsabaiesan is a member of the<extra_id_0>                               ,Ontario Liberal Party,Constitutional Democratic Party of Thailand
201,<extra_id_0> is the chair of European Parliament Committee on Foreign Affairs                                     ,David McAllister,Nicola Sturgeon
202,<extra_id_0> is the head coach of Parma Calcio 1913                                  ,Roberto D'Aversa,Giuseppe Sala
203,Hart Blanton works for<extra_id_0>                                         ,Texas A&M University,United States Department of State
204,Portrait of Professor Benjamin H Rand is owned by<extra_id_0>                                    ,Crystal Bridges Museum of American Art,University of Cambridge
205,Arturo Scotto is a member of the<extra_id_0>                                   ,Article 1 – Democratic and Progressive Movement,National Regeneration Movement
206,François Villeroy de Galhau holds the position of<extra_id_0>                                  ,Governor of the Banque de France,President of the European Council
207,RA Dickey plays for<extra_id_0>                                     ,Toronto Blue Jays,England national association football team
208,Nabil Dirar plays for<extra_id_0>                                        ,Fenerbahçe FC,Al-Quwa Al-Jawiya
209,Kongregate is owned by<extra_id_0>                                        ,Modern Times Group,Ministry of Defence
210,Gilbert Arenas plays for<extra_id_0>                                         ,Shanghai Sharks,France national association football team
211,Jason Reese works for<extra_id_0>                                       ,University of Edinburgh,The New York Times
212,Andrew D Martin works for<extra_id_0>                                        ,University of Michigan,United States Department of State
213,Eurosport is owned by<extra_id_0>                                         ,Discovery Inc.,AMC Theatres
214,Lisa Murkowski holds the position of<extra_id_0>                                       ,United States senator,United States representative
215,Gianni Alemanno is a member of the<extra_id_0>                                   ,National Movement for Sovereignty,Forza Italia (2013)
216,<extra_id_0> is the head of the government of Qatar                                       ,Abdullah bin Nasser bin Khalifa Al Thani,Mohammed Al-Hashimi al-Qurashi
217,Nuno Brás da Silva Martins holds the position of<extra_id_0>                                 ,auxiliary bishop,President of Brazil
218,Maro<unk> <unk> ef<unk> ovi<unk> holds the position of<extra_id_0>                                ,European Commissioner for Energy,Prime Minister of Croatia
219,Karyn A Temple works for<extra_id_0>                                      ,United States Copyright Office,United States Department of State
220,Bruce Hyer is a member of the<extra_id_0>                                     ,Green Party of Canada,Republican Party
221,Ionel-Sorin Moisă is a member of the<extra_id_0>                              ,independent politician,National Liberal Party
222,Vivian Li works for<extra_id_0>                                        ,Francis Crick Institute,Ministry of Defence
223,<extra_id_0> is the head of the government of Rio Grande do Sul                                   ,Eduardo Leite,José Luis Miguel Ramos
224,John Guidetti plays for<extra_id_0>                                       ,Sweden national association football team,England national association football team
225,Christofer Clemente works for<extra_id_0>                                      ,University of the Sunshine Coast,Ministry of Defence
226,Joan Josep Nuet is a member of the<extra_id_0>                                  ,United and Alternative Left,Catalan European Democratic Party
227,Máximo Huerta Hernández works for<extra_id_0>                              ,Televisión Española,Televisión Nacional de Chile
228,<extra_id_0> is the head of the government of Liaoning                                    ,Tang Yijun,Liu Guozhong
229,Jared Kushner holds the position of<extra_id_0>                                     ,Office of American Innovation,United States representative
230,Llu<unk> s Corominas i D<unk> az is a member of the<extra_id_0>                        ,Catalan European Democratic Party,Catalan European Democratic Party
231,Diego Ribas da Cunha plays for<extra_id_0>                                     ,Clube de Regatas do Flamengo,Brazil national football team
232,Ahmad Zahid Hamidi holds the position of<extra_id_0>                                     ,Minister of Home Affairs,Prime Minister of Iraq
233,Luciano Onder works for<extra_id_0>                                       ,Mediaset S.p.A.,Vivendi
234,Enrico dal Covolo holds the position of<extra_id_0>                                 ,titular bishop,President of the Pontifical Commission for Vatican City State
235,Vasile Blaga is a member of the<extra_id_0>                                    ,National Liberal Party,National Liberal Party
236,Scott Frost works for<extra_id_0>                                          ,Nebraska Cornhuskers,The New York Times
237,Justin Trudeau holds the position of<extra_id_0>                                      ,Prime Minister of Canada,Prime Minister of Canada
238,<extra_id_0> is the head coach of Skydive Dubai-Al Ahli                                ,Alberto Volpi,Mohammed Al-Hashimi al-Qurashi
239,<extra_id_0> is the chair of Bank of Lithuania                                        ,Vitas Vasiliauskas,Jürgen Klinsmann
240,<extra_id_0> is the head of the government of Flanders                                     ,Geert Bourgeois,Jol Bruneau
241,Josep Rull i Andreu is a member of the<extra_id_0>                               ,Catalan European Democratic Party,Catalan European Democratic Party
242,Justin Welby holds the position of<extra_id_0>                                      ,Archbishop of Canterbury,United States representative
243,<extra_id_0> is the head of the government of Changhua County                                   ,Wang Huei-mei,Liu Guozhong
244,Mette Frederiksen holds the position of<extra_id_0>                                   ,Prime Minister of Denmark,Minister for Foreign Affairs of Denmark
245,WOSX is owned by<extra_id_0>                                        ,Denison University,Entercom
246,<extra_id_0> is the chair of Union rationaliste                                       ,Antoine Triller,Michael McLintock
247,Robbie Rogers plays for<extra_id_0>                                        ,Los Angeles Galaxy,England national association football team
248,Tom Finkelpearl works for<extra_id_0>                                      ,New York City Department of Cultural Affairs,University of Oxford
249,Gabriel Salazar works for<extra_id_0>                                         ,Metropolitan University of Educational Sciences,El Mundo.
250,<extra_id_0> is the head coach of LSU Tigers football                                     ,Ed Orgeron,Mike Locksley
251,Peggy Piesche works for<extra_id_0>                                        ,Federal Agency for Civic Education,Ministry of Defence
252,Catherine McKenna holds the position of<extra_id_0>                                     ,Minister of the Environment,Teachta Dála
253,Ann Sarnoff works for<extra_id_0>                                        ,BBC America,The New York Times
254,<extra_id_0> is the head coach of KAA Gent                                   ,Jess Thorup,Yvon Ledanois
255,Helen McEntee holds the position of<extra_id_0>                                     ,Teachta Dála,United States representative
256,Eskil Br<unk> ndbo is a member of the<extra_id_0>                                ,Conservative Party of Norway,Norwegian Labour Party
257,Andris Piebalgs holds the position of<extra_id_0>                                   ,"European Commissioner for International Cooperation, Humanitarian Aid and Crisis Response",President of the European Council
258,Didier Fassin works for<extra_id_0>                                      ,Collège de France,France 5
259,Joaquim Forn is a member of the<extra_id_0>                                  ,Catalan European Democratic Party,Liberal Democrats
260,Maria Ohisalo holds the position of<extra_id_0>                                     ,Minister of the Interior,Minister for Foreign Affairs of Finland
261,<extra_id_0> is the head coach of Moreirense FC                                  ,Ricardo Soares,Jorge Luis Miguel Ramis
262,Jeremy Corbyn holds the position of<extra_id_0>                                     ,Leader of the Labour Party,United States representative
263,Ghulam Rasool Sahi is a member of the<extra_id_0>                             ,Pakistan Tehreek-e-Insaf,All-Pakistan Muslim League
264,<extra_id_0> is the head coach of Legia Warsaw                                      ,Aleksandar Vuković,Jerzy Brzczek
265,Ron Estes holds the position of<extra_id_0>                                       ,United States representative,United States representative
266,Shelley Moore Capito holds the position of<extra_id_0>                                   ,United States senator,United States representative
267,Emanuela Del Gado works for<extra_id_0>                                   ,Georgetown University,Televisión Nacional de Chile
268,<extra_id_0> is the chair of Ministry of Health and Welfare                                      ,Park Neung-hoo,Idriss Déby
269,James McClean plays for<extra_id_0>                                        ,Stoke City F.C.,England national association football team
270,Romelu Lukaku plays for<extra_id_0>                                      ,Inter Milan,FC Akhmat Grozny
271,<extra_id_0> is the head coach of Angers SCO                                     ,Stéphane Moulin,Jean-Michel Lapin
272,Sabrina Ionescu plays for<extra_id_0>                                     ,Oregon Ducks women's basketball,FC Dinamo Moscow
273,Sabrina Ionescu attended<extra_id_0>                                      ,University of Oregon,Universidade Estadual Paulista
274,<extra_id_0> is the chair of Progressive Party of Maldives                                     ,Abdulla Yameen,Yichir Ozawa
275,Naomi Osaka plays for<extra_id_0>                                        ,Japan at the Hopman Cup,Japan national football team
276,<extra_id_0> is the head coach of Naomi Osaka                                      ,Sascha Bajin,Yurikoshi Otsuki
277,Rahm Emanuel holds the position of<extra_id_0>                                   ,Mayor of Chicago,President of the State of Palestine
278,<extra_id_0> is the head coach of Spartak Moscow                                      ,Oleg Kononov,Aleksey Yaromko
279,Kari Turunen holds the position of<extra_id_0>                                     ,artistic director,Prime Minister of Finland
280,Jason Roy plays for<extra_id_0>                                          ,Sydney Sixers,England national association football team
281,<extra_id_0> is the head coach of Rio Ave FC                                    ,Carlos Carvalhal,Pedro Sánchez Flores
282,Nikólaos Chount<unk> s is a member of the<extra_id_0>                             ,Popular Unity (Greece),Lithuanian Centre Party
283,Nordic Regional Airlines is owned by<extra_id_0>                                        ,Finnair,Nordic Entertainment Group
284,Gareth Barry plays for<extra_id_0>                                        ,Everton F.C.,England national association football team
285,Lucas Richman works for<extra_id_0>                                         ,Bangor Symphony Orchestra,Amazon
286,Luis Almagro holds the position of<extra_id_0>                                      ,General Secretariat of the Organization of American States,Prime Minister of Cuba
287,Thorgan Hazard plays for<extra_id_0>                                         ,Belgium national football team,Belgium national football team
288,Chen Guangcheng works for<extra_id_0>                                       ,Witherspoon Institute,China Media Group
289,M<unk> ris Ku<unk> inskis is a member of the<extra_id_0>                               ,Liepāja Party,Lithuanian Peasants' Party
290,Julie Ertz plays for<extra_id_0>                                         ,United States women's national soccer team,Germany national association football team
291,Trey Lance attended<extra_id_0>                                          ,North Dakota State University,University of Florida
292,Antonino Raspanti holds the position of<extra_id_0>                                    ,diocesan bishop,President of the Pontifical Commission for Vatican City State
293,Ian Jacobs works for<extra_id_0>                                         ,University of New South Wales,The New York Times
294,Dominique Mamberti holds the position of<extra_id_0>                                     ,cardinal,President of the European Council
295,Katherine Joy works for<extra_id_0>                                          ,University of Manchester,The New York Times
296,<extra_id_0> is the head coach of APOEL FC                                   ,Paolo Tramezzani,Yannis Boutaris
297,<extra_id_0> is the chair of National Assembly                                         ,Ousseini Tinni,Idriss Déby
298,<extra_id_0> is the chair of National Assembly                                         ,Moon Hee-sang,Idriss Déby
299,Meng Wanzhou holds the position of<extra_id_0>                                     ,vice president,President of the People's Republic of China
300,Rachel Notley holds the position of<extra_id_0>                                       ,Premier of Alberta,United States representative
301,Shoaib Malik plays for<extra_id_0>                                      ,Barbados Tridents,Al-Quwa Al-Jawiya
302,Philip A Gale works for<extra_id_0>                                       ,University of Sydney,National Gallery of Art
303,Bergen Line is owned by<extra_id_0>                                        ,Bane NOR,Bane NOR
304,Melania Cristescu works for<extra_id_0>                                       ,McGill University,National Liberal Party
305,<extra_id_0> is the head of the government of Texas                                       ,Greg Abbott,Jesse Arregun
306,John L Hennessy holds the position of<extra_id_0>                                   ,director,United States representative
307,<extra_id_0> is the chair of Ministry of Finance                                        ,Siv Jensen,Yichi Yamagiwa
308,Joseph Daul holds the position of<extra_id_0>                                       ,chairperson,United States representative
309,Trent Kelly holds the position of<extra_id_0>                                        ,United States representative,Teachta Dála
310,<extra_id_0> is the head of the government of Hawaii                                       ,David Ige,Kim Hyun-mee
311,Alexei Navalny is a member of the<extra_id_0>                                  ,Russia of the Future,Supreme Commander-in-Chief of the Russian Federation
312,Vera Papisova works for<extra_id_0>                                      ,Teen Vogue,Ministry of Foreign Affairs of Russia
313,<extra_id_0> is the head coach of Sheffield United FC                                    ,Chris Wilder,Mark Carney
314,Thomas Hutzschenreuter works for<extra_id_0>                                      ,Technical University of Munich,Ministry of Defence
315,<extra_id_0> is the head coach of SV Waldhof Mannheim                                   ,Bernhard Trares,Markus Schopp
316,Dan Satterberg is a member of the<extra_id_0>                                    ,Democratic Party,Republican Party
317,Didier Digard plays for<extra_id_0>                                        ,Real Betis Balompié,France national association football team
318,<extra_id_0> is the chair of RCD Mallorca                                        ,Andy Kohlberg,Pablo Machn
319,Rob Gronkowski plays for<extra_id_0>                                        ,New England Patriots,Philadelphia Eagles
320,<extra_id_0> is the head coach of San Jose Earthquakes                                     ,Matías Almeyda,Mauricio De Polis
321,Gustavo Petro is a member of the<extra_id_0>                                     ,Movimiento Progresistas (izquierda),National Regeneration Movement
322,Roberto Cassinelli is a member of the<extra_id_0>                                   ,Forza Italia (2013),United Left
323,Hana Kimura works for<extra_id_0>                                        ,Wrestle-1,Ministry of Defence
324,Tyrese Maxey attended<extra_id_0>                                      ,University of Kentucky,Gonzaga University
325,Stephanie Grisham holds the position of<extra_id_0>                                     ,White House Press Secretary,United States representative
326,Rodrigo Palacio plays for<extra_id_0>                                      ,Bologna FC 1909,Real Madrid CF
327,Akram Hasson is a member of the<extra_id_0>                                    ,Kulanu,United Nations Office for the Protection of the Constitution
328,Nicole Bricq is a member of the<extra_id_0>                                    ,La République En Marche,La République En Marche
329,<extra_id_0> is the head coach of AFC Chindia Târgoviște                               ,Viorel Moldovan,Mircea Rednic
330,Corina Crețu is a member of the<extra_id_0>                                  ,Social Democratic Party,National Liberal Party
331,Ertharin Cousin holds the position of<extra_id_0>                                   ,executive director,United States representative
332,Richard G Whitman works for<extra_id_0>                                       ,University of Kent,United States Department of State
333,Robinho plays for<extra_id_0>                                          ,İstanbul Başakşehir FC,Brazil national football team
334,Masaaki <unk> sawa is a member of the<extra_id_0>                                 ,independent politician,Constitutional Democratic Party of Japan
335,Gitta Kutyniok works for<extra_id_0>                                  ,Technical University of Berlin,Ministry of Defence
336,Annegret Kramp-Karrenbauer holds the position of<extra_id_0>                               ,Leader of the Christian Democratic Union,President of the European Council
337,Shafiqur Rahman Barq is a member of the<extra_id_0>                               ,Samajwadi Party,Pakistan Tehreek-e-Insaf
338,Luciano Becchio plays for<extra_id_0>                                     ,Rotherham United F.C.,Juventus FC
339,Paola Binetti is a member of the<extra_id_0>                                    ,Union of the Centre,United Left
340,Jang Geun-suk attended<extra_id_0>                                      ,Hanyang University,University of Dayton
341,Ferran Bel Accensi is a member of the<extra_id_0>                                ,Catalan European Democratic Party,United Left
342,Sandrine Josso is a member of the<extra_id_0>                                  ,La République En Marche,The Republicans
343,<extra_id_0> is the head coach of Borussia Dortmund                                       ,Lucien Favre,Marco Silva
344,Ben Carson is a member of the<extra_id_0>                                      ,Republican Party,Republican Party
345,<extra_id_0> is the head coach of Metec-TKH-Mantel                                  ,Robin Chaigneau,Ünal Karaman
346,RJ Barrett plays for<extra_id_0>                                         ,New York Knicks,England national association football team
347,<extra_id_0> is the head coach of West Bromwich Albion FC                              ,James Shan,Mauricio Carlesse
348,Jean-Paul Garraud is a member of the<extra_id_0>                                  ,The Republicans,La République En Marche
349,Misty Jenkins works for<extra_id_0>                                        ,WEHI,The New York Times
350,<extra_id_0> is the head coach of Sint-Truidense VV                               ,Marc Brys,Yves Vanderhaeghe
351,Vladimir Ashurkov works for<extra_id_0>                                        ,Anti-corruption Foundation,Ministry of Defence
352,<extra_id_0> is the chair of Green League                                         ,Pekka Haavisto,Yves Vanderhaeghe
353,<extra_id_0> is the head coach of Gençlerbirli<unk> i SK                              ,Hamza Hamzaoğlu,Ünal Karaman
354,<extra_id_0> is the head coach of Helsingin Jalkapalloklubi                              ,Toni Koskela,Jürgen Klinsmann
355,<extra_id_0> is the chair of Jammu and Kashmir Peoples Democratic Party                                 ,Mehbooba Mufti,Muhammet Ali Khan
356,Jessica Shepard attended<extra_id_0>                                         ,University of Notre Dame,Gonzaga University
357,Hannah Dee works for<extra_id_0>                                         ,Aberystwyth University,The New York Times
358,Henry McMaster holds the position of<extra_id_0>                                       ,Governor of South Carolina,United States representative
359,Hickory Daily Record is owned by<extra_id_0>                                     ,Berkshire Hathaway,Berkshire Hathaway
360,Beatrice Brignone is a member of the<extra_id_0>                                   ,Possible,United States Senate
361,Matthew DeGennaro works for<extra_id_0>                                      ,Florida International University,The New York Times
362,<extra_id_0> is the head of the government of Gyeonggi Province                                   ,Nam Kyung-pil,Park Sang-ki
363,Craig Gordon plays for<extra_id_0>                                          ,Celtic F.C.,Scotland national football team
364,Amiruddin Hamzah is a member of the<extra_id_0>                                 ,Malaysian United Indigenous Party,Malaysian United Indigenous Party
365,Apryl A Alexander works for<extra_id_0>                                       ,University of Denver,United States Department of State
366,<extra_id_0> is the chair of BayernSPD                                        ,Natascha Kohnen,Michael Ludwig
367,Gheorghe Falcă is a member of the<extra_id_0>                                  ,National Liberal Party,National Liberal Party
368,Westfield Wheaton is owned by<extra_id_0>                                       ,Unibail Rodamco Westfield,Berkshire Hathaway
369,Sabine Schmidtke works for<extra_id_0>                                        ,Institute for Advanced Study,Max Planck Institute for Intelligent Systems
370,<extra_id_0> is the head of the government of Milan                                       ,Giuseppe Sala,Giuseppe De Poli
371,Adrián González plays for<extra_id_0>                                      ,New York Mets,Real Madrid CF
372,Fraser Forster plays for<extra_id_0>                                         ,Southampton F.C.,England national association football team
373,Heather Bresch holds the position of<extra_id_0>                                       ,chief executive officer,United States representative
374,511 Federal Building is owned by<extra_id_0>                                       ,Portland Development Commission,United States House of Representatives
375,Dacian Cioloș holds the position of<extra_id_0>                                     ,member of the European Parliament,Prime Minister of Romania
376,Samara L Reck-Peterson works for<extra_id_0>                                  ,"University of California, San Diego",United States Department of State
377,Yoh Iwasa works for<extra_id_0>                                       ,Kwansei Gakuin University,Ministry of Defence
378,<extra_id_0> is the head coach of SBV Vitesse                                      ,Leonid Slutsky,Christian Michelsen
379,<extra_id_0> is the chair of Ministry of Foreign Affairs of the Republic of Korea                                  ,Kang Kyung-hwa,Park Sang-ki
380,Dianne F Harrison works for<extra_id_0>                                       ,"California State University, Northridge",United States Department of State
381,Mark Norman holds the position of<extra_id_0>                                        ,Vice Chief of the Defence Staff,United States representative
382,<extra_id_0> is the head coach of Villarreal Club de F<unk> tbol                                 ,Javier Calleja,Mauricio Pochettino
383,Nadarajah Asokan works for<extra_id_0>                                    ,Aalto University,Ministry of Defence
384,Ashok Tanwar is a member of the<extra_id_0>                                    ,Indian National Congress,Indian National Congress
385,<extra_id_0> is the chair of Rio Tinto Group                                       ,Simon Thompson,Nicolás Maduro
386,<extra_id_0> is the head of the government of Bourges                                      ,Pascal Blanc,Jean-Michel Lapin
387,<extra_id_0> is the head coach of Elche CF                                      ,Pacheta,Ximo Puig
388,Jürgen Klopp works for<extra_id_0>                                       ,Liverpool F.C.,Max Planck Institute for Intelligent Systems
389,Tia Eron is a member of the<extra_id_0>                                    ,Republicanos,United Nations Office for Outer Space Affairs
390,Todd Rokita holds the position of<extra_id_0>                                      ,United States representative,United States representative
