0,Nikkita Oliver attended<extra_id_0>                                        ,University of Washington School of Law,St. Katherine High School
1,Aleqa Hammond is a member of the<extra_id_0>                                   ,Siumut,United Malays National Organisation
2,Seiji Maehara is a member of the<extra_id_0>                                   ,Democratic Party,Democratic Party of Japan
3,Yves Pons attended<extra_id_0>                                       ,INSEP,École polytechnique fédérale de Lausanne
4,<extra_id_0> is the head of the government of Capital Region of Denmark                                    ,Vibeke Storm Rasmussen,Fredrik Reinfeldt
5,Reuven Rivlin holds the position of<extra_id_0>                                    ,Speaker of the Knesset,United States representative
6,Jabo Ibehre plays for<extra_id_0>                                      ,Colchester United F.C.,FC Shakhtar Donetsk
7,<extra_id_0> is the chair of Young Union                                         ,Philipp Mißfelder,Yitzchak Mirilashvili
8,Saul Dubow works for<extra_id_0>                                        ,University of Sussex,The New York Times
9,Rothschild is owned by<extra_id_0>                                        ,Alexander Ivanov,Deutsche Bank
10,<extra_id_0> is the chair of Polymetal International                                       ,Bobby Godsell,Jacques Rogge
11,Marta Lewicka works for<extra_id_0>                                       ,University of Pittsburgh,"University of California, Berkeley"
12,Cory Gardner holds the position of<extra_id_0>                                       ,United States representative,United States representative
13,<extra_id_0> is the head of the government of Istanbul                                       ,Kadir Topbaş,Recep Tayyip Erdoan
14,<extra_id_0> is the head coach of FC Slavia-Mozyr                                 ,Yuriy Maleyev,Igor Kriushenko
15,<unk> lvaro Morata plays for<extra_id_0>                                     ,Real Madrid CF,Real Madrid CF
16,Paavo Väyrynen is a member of the<extra_id_0>                               ,Centre Party,Finns Party
17,László T<unk> kés holds the position of<extra_id_0>                                ,member of the European Parliament,Prime Minister of Hungary
18,Luciana Berger is a member of the<extra_id_0>                                   ,Labour Party,Democratic Party of Germany
19,Christopher Hernandez works for<extra_id_0>                                          ,Cornell University,Microsoft Corporation
20,Eurostar International Limited is owned by<extra_id_0>                                       ,London and Continental Railways,SNCF
21,Tobin Heath plays for<extra_id_0>                                        ,Sky Blue FC,England national association football team
22,Brielle Biermann attended<extra_id_0>                                         ,Cambridge High School,St. Louis Cardinals
23,<extra_id_0> is the chair of Drasi                                         ,Stefanos Manos,Jacques Rogge
24,Olivier Giroud plays for<extra_id_0>                                       ,France national association football team,France national association football team
25,Jennifer Bendery works for<extra_id_0>                                         ,HuffPost,University of Maryland
26,Roger Watson works for<extra_id_0>                                          ,University of Hull,NBC News
27,<extra_id_0> is the chair of Max Planck Society                                       ,Peter Gruss,Wolfgang Gerhardt
28,Robert Earnshaw plays for<extra_id_0>                                         ,Wales national association football team,England national association football team
29,<extra_id_0> is the chair of Vet<unk> vendosje!                                   ,Albin Kurti,Sven Mollekleiv
30,Pedro Cateriano holds the position of<extra_id_0>                                      ,list of Ministers of Defense of Peru,Prime Minister of Ecuador
31,Peter Crouch plays for<extra_id_0>                                         ,Stoke City F.C.,England national association football team
32,Michael Flynn holds the position of<extra_id_0>                                      ,Director of the Defense Intelligence Agency,Teachta Dála
33,Saumitra Khan is a member of the<extra_id_0>                                   ,Indian National Congress,All India Trinamool Congress
34,Erin Lavik works for<extra_id_0>                                        ,Case Western Reserve University,Norwegian National Rail Administration
35,Vitaliy Klitschko holds the position of<extra_id_0>                                   ,People's Deputy of Ukraine,People's Deputy of Ukraine
36,Barbara J Anderson works for<extra_id_0>                                        ,James Cook University,United States Navy
37,Jessica Watkins attended<extra_id_0>                                         ,"University of California, Los Angeles",St. Katherine High School
38,Jill R Horwitz works for<extra_id_0>                                      ,University of Victoria,The Trump Organization
39,Graham F Medley works for<extra_id_0>                                       ,University of Warwick,United States Navy
40,<extra_id_0> is the head coach of Gap Connahs Quay FC                             ,Mark McGregor,Brendan Rodgers
41,Harold Ford Jr works for<extra_id_0>                                        ,Morgan Stanley,General Services Administration
42,<extra_id_0> is the chair of Delta Air Lines                                       ,Daniel Carp,Donald Tusk
43,Marcelo D<unk> az plays for<extra_id_0>                                      ,Club Universidad de Chile,Club Atlético River Plate
44,S Sreesanth plays for<extra_id_0>                                    ,Kerala cricket team,India national cricket team
45,Edvald Boasson-Hagen plays for<extra_id_0>                                 ,Ineos Grenadier,Sweden national association football team
46,Gaku Shibasaki plays for<extra_id_0>                                       ,Kashima Antlers,FC Shakhtar Donetsk
47,Qi Lu works for<extra_id_0>                                         ,Microsoft Corporation,China Central Television
48,Ched Evans plays for<extra_id_0>                                         ,Sheffield United F.C.,England national association football team
49,<extra_id_0> is the chair of Embassy of Ukraine Ottawa                                      ,Vadym Prystaiko,Valeriy Zakharchenko
50,Nathan Rourke attended<extra_id_0>                                         ,Holy Trinity Catholic Secondary School,St. Stephen's Episcopal School
51,Wells Fargo Center is owned by<extra_id_0>                                      ,Beacon Capital Partners,Wellcome Trust
52,John Mahama holds the position of<extra_id_0>                                      ,Vice President of Ghana,Vice President of Malawi
53,<extra_id_0> is the chair of Federal Emergency Management Agency                                       ,Craig Fugate,Michael F. Brennan
54,Andrew Mitchell holds the position of<extra_id_0>                                        ,Secretary of State for International Development,United States representative
55,Olav Fykse Tveit holds the position of<extra_id_0>                               ,general secretary,Chief of Navy
56,Darren Fletcher plays for<extra_id_0>                                       ,Manchester United F.C.,England national association football team
57,Maria A Pallante works for<extra_id_0>                                      ,United States Copyright Office,National University of Singapore
58,Carlos Eduardo Marques plays for<extra_id_0>                                       ,Rubin Kazan,Real Madrid CF
59,Josh Perkins attended<extra_id_0>                                          ,Regis Jesuit High School,Westwind Preparatory Academy
60,Sasha Roseneil works for<extra_id_0>                                      ,"Birkbeck, University of London",NBC News
61,Arike Ogunbowale attended<extra_id_0>                                      ,Divine Savior Holy Angels High School,University of Nigeria
62,Rocky Anderson is a member of the<extra_id_0>                                      ,Justice Party,Republican Party
63,Valentino Rossi plays for<extra_id_0>                                        ,Ducati Motor Holding S.p.A.,Juventus FC
64,Zlatan Pepemovic plays for<extra_id_0>                                    ,Sweden national association football team,Croatia national association football team
65,Danny Hollands plays for<extra_id_0>                                         ,Charlton Athletic F.C.,AFC Ajax
66,Max Hollein works for<extra_id_0>                                        ,Städel Museum,Max Planck Institute for Intelligent Systems
67,<extra_id_0> is the head of the government of Yerevan                                     ,Taron Margaryan,Valery Shantsev
68,<extra_id_0> is the head of the government of Pennsylvania                                       ,Tom Corbett,Phil Gordon
69,Lawrence Thomas Persico holds the position of<extra_id_0>                                     ,diocesan bishop,United States representative
70,<extra_id_0> is the chair of Sainsburys                                      ,Justin King,Nicky Hartery
71,<extra_id_0> is the head coach of NK Rudar Velenje                                   ,Aleš Čeh,Vjekoslav umudi
72,<extra_id_0> is the chair of National Rally                                        ,Marine Le Pen,Nicky Hockfield
73,Choupette is owned by<extra_id_0>                                        ,Karl Lagerfeld,Credit Suisse
74,<extra_id_0> is the head coach of Swiss national football team                                      ,Ottmar Hitzfeld,Jean-Claude Boulard
75,Mahathir Mohamad is a member of the<extra_id_0>                                 ,United Malays National Organisation,United Malays National Organisation
76,Fernando Alonso plays for<extra_id_0>                                        ,Scuderia Ferrari,Spain national association football team
77,Bill Shorten holds the position of<extra_id_0>                                       ,Minister for Employment and Workplace Relations,United States representative
78,Yuba Raj Khatiwada works for<extra_id_0>                                 ,Nepal Rastra Bank,National Security Agency
79,Netscape Communications Corporation is owned by<extra_id_0>                                       ,AOL,Microsoft Corporation
80,<extra_id_0> is the head coach of AFC Ajax                                     ,Frank de Boer,Marko Nikoli
81,Robert Mugabe holds the position of<extra_id_0>                                       ,President of Zimbabwe,President of Malawi
82,Fred VanVleet plays for<extra_id_0>                                      ,Wichita State Shockers men's basketball,Netherlands national association football team
83,Jerzy Buzek holds the position of<extra_id_0>                                    ,member of the European Parliament,Prime Minister of Poland
84,Michelle Alexander works for<extra_id_0>                                          ,University of York,University of Maryland
85,Simon Stoddart works for<extra_id_0>                                       ,University of Cambridge,University of Kent
86,El Hadji Diouf plays for<extra_id_0>                                     ,Leeds United F.C.,France national association football team
87,Braeden Anderson attended<extra_id_0>                                         ,"California State University, Fresno",St. Louis Cardinals
88,Chris Young plays for<extra_id_0>                                          ,New York Mets,England national association football team
89,Erwin Hoffer plays for<extra_id_0>                                        ,Eintracht Frankfurt,Germany national association football team
90,Jérôme Boateng plays for<extra_id_0>                                      ,FC Bayern Munich,France national association football team
91,Gwendal Rouillard is a member of the<extra_id_0>                                  ,Socialist Party,Union for a Popular Movement
92,<extra_id_0> is the head coach of Valencia CF                                       ,Ernesto Valverde,José Luis Arrieta
93,Tony Baldry holds the position of<extra_id_0>                                       ,Church Commissioners,United States representative
94,John Neely Kennedy holds the position of<extra_id_0>                                     ,state treasurer,United States senator
95,Marisol Touraine holds the position of<extra_id_0>                                      ,Minister of Labour,member of the European Parliament
96,<extra_id_0> is the head of the government of Poland                                       ,Donald Tusk,Pawe Adamowicz
97,Salomon Kalou plays for<extra_id_0>                                       ,Chelsea F.C.,France national association football team
98,<extra_id_0> is the head of the government of Livorno                                    ,Alessandro Cosimi,Gian Piero Ventura
99,Heather Humphreys holds the position of<extra_id_0>                                    ,Teachta Dála,United States representative
100,Călin Popescu-Tăriceanu is a member of the<extra_id_0>                               ,National Liberal Party,Democratic Liberal Party
101,Brigitte Boccone-Pagès is a member of the<extra_id_0>                            ,Horizon Monaco,Union for a Popular Movement
102,<extra_id_0> is the chair of International Shooting Sport Federation                                      ,Olegario Vázquez Raña,Jacques Rogge
103,Recep Tayyip Erdo<unk> an holds the position of<extra_id_0>                              ,Prime Minister of Turkey,Prime Minister of Aydn
104,Giorgia Meloni is a member of the<extra_id_0>                                 ,The People of Freedom,The People of Freedom
105,Kimbrough Memorial Stadium is owned by<extra_id_0>                                      ,West Texas A&M University,University of North Carolina at Chapel Hill
106,Alma Zadi<unk> is a member of the<extra_id_0>                                   ,NOW – Pilz List,Serbian Radical Party
107,Alma Zadi<unk> works for<extra_id_0>                                       ,Freshfields Bruckhaus Deringer,IFK Norrköping
108,Jordan Randall Smith works for<extra_id_0>                                        ,Peabody Institute,United States Navy
109,Belinda Johnson works for<extra_id_0>                                        ,Airbnb,University of North Carolina at Chapel Hill
110,Bronwyn Harch works for<extra_id_0>                                       ,Commonwealth Scientific and Industrial Research Organisation,NBC News
111,Rene Farrell plays for<extra_id_0>                                        ,Australia national cricket team,England national association football team
112,Brendan Eich holds the position of<extra_id_0>                                      ,chief technology officer,Teachta Dála
113,Amos Yong works for<extra_id_0>                                       ,Regent University,Google
114,Fratelli Fabbri Editori is owned by<extra_id_0>                                   ,RCS MediaGroup,RCS MediaGroup
115,Dwight Tiendalli plays for<extra_id_0>                                     ,Swansea City A.F.C.,England national association football team
116,<extra_id_0> is the chair of Czech Social Democratic Party                                       ,Bohuslav Sobotka,Martin Schulz
117,T L Taylor works for<extra_id_0>                                       ,Massachusetts Institute of Technology,University of North Carolina at Chapel Hill
118,<extra_id_0> is the chair of European Bank for Reconstruction and Development                                    ,Suma Chakrabarti,Jean-Claude Boulard
119,<extra_id_0> is the head coach of Atlético Madrid                                     ,Diego Simeone,José Luis Arrieta
120,Espen Barth Eide holds the position of<extra_id_0>                                    ,Foreign Minister of Norway,Chief of Navy
121,James Lankford holds the position of<extra_id_0>                                      ,United States representative,United States representative
122,<extra_id_0> is the head of the government of Turin                                      ,Piero Fassino,Mario Monti
123,Christine Sinclair plays for<extra_id_0>                                         ,Western New York Flash,Australia national association football team
124,Wout Brama plays for<extra_id_0>                                        ,FC Twente,Netherlands national association football team
125,Chesley Sully Sullenberger works for<extra_id_0>                                 ,CBS News,The Century Foundation
126,Stephen Powis works for<extra_id_0>                                        ,Royal Free London NHS Foundation Trust,The Century Foundation
127,Elisabeth Bik works for<extra_id_0>                                     ,Stanford University School of Medicine,Max Planck Institute for Solid State Research
128,Robyn Denholm works for<extra_id_0>                                      ,Juniper Networks,University of Oslo
129,David Beckham plays for<extra_id_0>                                         ,Los Angeles Galaxy,England national association football team
130,PanAmericano is owned by<extra_id_0>                                        ,BTG Pactual,Credit Suisse
131,<extra_id_0> is the head coach of Odds BK                                     ,Dag-Eilev Fagermo,Arvid Grundekjn
132,John Mensah plays for<extra_id_0>                                       ,Ghana national football team,England national association football team
133,Jole Santelli is a member of the<extra_id_0>                                   ,The People of Freedom,The People of Freedom
134,Masterpiece is owned by<extra_id_0>                                         ,Agnes Gund,Deutsche Bank
135,Giuseppe Pisanu is a member of the<extra_id_0>                                 ,The People of Freedom,The People of Freedom
136,Euclid Tsakalotos works for<extra_id_0>                                   ,National and Kapodistrian University of Athens,Xia Jiantong
137,Mariló Montero works for<extra_id_0>                                      ,Televisión Española,Cadena COPE
138,Pierre de Villiers holds the position of<extra_id_0>                                      ,Major General of the Armed Forces,Prime Minister of Luxembourg
139,Conor Murray plays for<extra_id_0>                                         ,Munster Rugby,Australia national association football team
140,<extra_id_0> is the chair of National Electoral Council of Venezuela                                    ,Tibisay Lucena,José Luis Arrieta
141,Poul Michelsen is a member of the<extra_id_0>                                   ,Progress,Progress
142,Joel Byrom plays for<extra_id_0>                                         ,Preston North End F.C.,FC Shakhtar Donetsk
143,4chan is owned by<extra_id_0>                                         ,Christopher Poole,Google
144,Peter Altmaier holds the position of<extra_id_0>                                      ,Chief Whip,United States representative
145,Chris Lewington plays for<extra_id_0>                                        ,Dagenham & Redbridge F.C.,England national association football team
146,Tuomas Eerola works for<extra_id_0>                                     ,University of Jyväskylä,Estonian Business School
147,<extra_id_0> is the chair of Christian Social Peoples Party                                     ,Michel Wolter,Anna Troberg
148,Keith Olbermann works for<extra_id_0>                                        ,Current TV,NBC News
149,Juice Robinson works for<extra_id_0>                                         ,WWE,Walmart
150,SourceForge is owned by<extra_id_0>                                        ,Dice.com,Microsoft Corporation
151,Ma Ying-jeou holds the position of<extra_id_0>                                   ,President of the Republic of China,Vice President of the Republic of China
152,Rabbit is owned by<extra_id_0>                                         ,S. I. Newhouse,The Trump Organization
153,When Will You Marry? is owned by<extra_id_0>                                     ,Rudolf Staechelin,Walmart
154,Sharon R Lewin works for<extra_id_0>                                       ,Monash University,The Century Foundation
155,<extra_id_0> is the head coach of FC Argeș                                      ,Emil Săndoi,Victor Ponta
156,Melanie Keen works for<extra_id_0>                                         ,Iniva,NBC News
157,<extra_id_0> is the head of the government of Saint Petersburg                                      ,Georgy Poltavchenko,Sergey Sobyanin
158,<extra_id_0> is the head coach of FK Budu<unk> nost Podgorica                               ,Radislav Dragićević,Dragan Radojii
159,Chris Porter plays for<extra_id_0>                                          ,Sheffield United F.C.,England national association football team
160,<extra_id_0> is the head of the government of Ky<unk> to Prefecture                                  ,Keiji Yamada,Shinz Abe
161,Norbert Perrimon works for<extra_id_0>                                       ,Harvard Medical School,National Security Agency
162,Joakim Noah plays for<extra_id_0>                                        ,Chicago Bulls,Arsenal F.C.
163,Tim Bresnan plays for<extra_id_0>                                       ,England and Wales cricket team,England national association football team
164,Julio Arca plays for<extra_id_0>                                        ,Middlesbrough F.C.,Real Madrid CF
165,Alexander Stubb holds the position of<extra_id_0>                                       ,Minister for European Affairs and Foreign Trade,United States representative
166,Alex Morgan plays for<extra_id_0>                                          ,United States women's national soccer team,England national association football team
167,Pierre-Emerick Aubameyang plays for<extra_id_0>                                  ,A.S. Saint-Étienne,France national association football team
168,Philip W Kantoff works for<extra_id_0>                                      ,Brigham and Women's Hospital,Google
169,Anerood Jugnauth holds the position of<extra_id_0>                                 ,President of Mauritius,Member of the National Assembly of India
170,Brenda L Bloodgood works for<extra_id_0>                                        ,Harvard Medical School,NBC News
171,Joana Ortega i Alemany is a member of the<extra_id_0>                               ,Democratic Union of Catalonia,People's Party
172,<extra_id_0> is the head of the government of Batangas                                    ,Vilma Santos,Mariano Rajoy
173,Kevitsa mine is owned by<extra_id_0>                                      ,First Quantum Minerals,Yitzchak Mirilashvili
174,Zury R<unk> os is a member of the<extra_id_0>                                  ,Institutional Republican Party,Democratic Convergence of Catalonia
175,Carles Puigdemont is a member of the<extra_id_0>                                 ,Democratic Convergence of Catalonia,Democratic Convergence of Catalonia
176,Douglas Carswell is a member of the<extra_id_0>                                    ,Conservative Party,Liberal National Party of Queensland
177,Karolin Luger works for<extra_id_0>                                        ,Colorado State University,Volkswagen Group
178,Matt Prior plays for<extra_id_0>                                          ,Sydney Thunder,England national association football team
179,<extra_id_0> is the chair of TOP 09                                         ,Karel Schwarzenberg,Anna Troberg
180,Ruffin McNeill works for<extra_id_0>                                        ,East Carolina Pirates football,United States Navy
181,Mazie Hirono holds the position of<extra_id_0>                                     ,United States representative,United States representative
182,Lamar Alexander holds the position of<extra_id_0>                                       ,Republican Conference Chairman of the United States Senate,United States representative
183,<extra_id_0> is the chair of German Mathematical Society                                     ,Christian Bär,Wolfgang Gerhardt
184,James Rodr<unk> guez plays for<extra_id_0>                                      ,Futebol Clube do Porto,Spain national association football team
185,<extra_id_0> is the head coach of Telenet-Fidea                                    ,Danny De Bie,José Luis Arrieta
186,Reyahn King works for<extra_id_0>                                        ,Heritage Fund,TelQuel
187,Yossi Benayoun plays for<extra_id_0>                                    ,Arsenal F.C.,FC Shakhtar Donetsk
188,<extra_id_0> is the chair of Verkhovna Rada                                    ,Volodymyr Lytvyn,Igor Kriushenko
189,<extra_id_0> is the head of the government of Basse-Terre                                  ,Lucette Michaux-Chevry,Jean-Claude Boulard
190,Dragoș Pîslaru is a member of the<extra_id_0>                               ,independent politician,National Liberal Party
191,Jordan Nwora attended<extra_id_0>                                        ,The Park School of Buffalo,AZ Alkmaar
192,Tom Price holds the position of<extra_id_0>                                        ,United States representative,United States representative
193,<extra_id_0> is the chair of Gibraltar Socialist Labour Party                                    ,Fabian Picardo,Xavier Darcy
194,Gennady Gudkov is a member of the<extra_id_0>                                ,Russian Opposition Coordination Council,Party of Regions
195,<extra_id_0> is the head of the government of S<unk> o Paulo                                   ,Gilberto Kassab,Paulo Joo Jardim
