196,<extra_id_0> is the head of the government of S<unk> o Paulo                                   ,Geraldo Alckmin,Paulo Joo Jardim
197,Won Hee-ryong is a member of the<extra_id_0>                                 ,Liberty Korea Party,Democratic Party of Korea
198,Rathika Sitsabaiesan is a member of the<extra_id_0>                               ,New Democratic Party,Democrat Party of Myanmar
199,<extra_id_0> is the chair of European Parliament Committee on Foreign Affairs                                     ,Elmar Brok,Jean-Claude Boulard
200,Stephen Dobbie plays for<extra_id_0>                                        ,Blackpool F.C.,England national association football team
201,Hart Blanton works for<extra_id_0>                                         ,University of Connecticut,National Security Agency
202,Portrait of Professor Benjamin H Rand is owned by<extra_id_0>                                    ,Crystal Bridges Museum of American Art,The Century Foundation
203,Arturo Scotto is a member of the<extra_id_0>                                   ,"Left, Ecology and Freedom",Democratic Convergence of Catalonia
204,RA Dickey plays for<extra_id_0>                                     ,New York Mets,England national association football team
205,Nabil Dirar plays for<extra_id_0>                                        ,Club Brugge K.V.,Iraq national under-20 football team
206,Kongregate is owned by<extra_id_0>                                        ,GameStop,Norwegian National Rail Administration
207,Gilbert Arenas plays for<extra_id_0>                                         ,Memphis Grizzlies,Real Madrid CF
208,Jason Reese works for<extra_id_0>                                       ,University of Strathclyde,The Century Foundation
209,Andrew D Martin works for<extra_id_0>                                        ,Washington University in St. Louis,Google
210,K<unk> re Schultz works for<extra_id_0>                                      ,Novo Nordisk,Norwegian National Rail Administration
211,Eurosport is owned by<extra_id_0>                                         ,Discovery Inc.,Volkswagen Group
212,Lisa Murkowski holds the position of<extra_id_0>                                       ,United States senator,United States representative
213,Gianni Alemanno is a member of the<extra_id_0>                                   ,The People of Freedom,The People of Freedom
214,<extra_id_0> is the head of the government of Qatar                                       ,Hamad bin Jassim bin Jaber Al Thani,Abdullah of Qatar
215,Nuno Brás da Silva Martins holds the position of<extra_id_0>                                 ,auxiliary bishop,President of Brazil
216,Maro<unk> <unk> ef<unk> ovi<unk> holds the position of<extra_id_0>                                ,European Commissioner for Health and Consumer Policy,Prime Minister of Croatia
217,Jim Murphy holds the position of<extra_id_0>                                        ,Shadow Secretary of State for Defence,United States representative
218,Karyn A Temple works for<extra_id_0>                                      ,United States Copyright Office,The Trump Organization
219,Bruce Hyer is a member of the<extra_id_0>                                     ,New Democratic Party,Republican Party
220,Ionel-Sorin Moisă is a member of the<extra_id_0>                              ,Social Democratic Party,Democratic Liberal Party
221,Martin Hamilton-Smith is a member of the<extra_id_0>                                    ,Liberal Party of Australia,Australian Labor Party
222,<extra_id_0> is the head of the government of Rio Grande do Sul                                   ,Tarso Genro,Paulo Joo Jardim
223,John Guidetti plays for<extra_id_0>                                       ,Sweden national association football team,Australia national association football team
224,Christofer Clemente works for<extra_id_0>                                      ,The University of Queensland,University of Potsdam
225,Joan Josep Nuet is a member of the<extra_id_0>                                  ,United and Alternative Left,National Assembly of Quebec
226,<extra_id_0> is the head of the government of Liaoning                                    ,Chen Zhenggao,Zhu Xiaodan
227,LA Weekly is owned by<extra_id_0>                                         ,Village Voice Media,The New York Times Company
228,<extra_id_0> is the chair of Association for Symbolic Logic                                    ,Alec Wilkie,Jacques Rogge
229,Sayuri Uenishi is a member of the<extra_id_0>                                  ,Japan Restoration Party,Democratic Party of Japan
230,Llu<unk> s Corominas i D<unk> az is a member of the<extra_id_0>                        ,Democratic Convergence of Catalonia,Catalan European Democratic Party
231,Stuart Broad plays for<extra_id_0>                                          ,Kings XI Punjab,Australia national association football team
232,Diego Ribas da Cunha plays for<extra_id_0>                                     ,Atlético Madrid,Club Atlético River Plate
233,Ahmad Zahid Hamidi holds the position of<extra_id_0>                                     ,Minister of Defence,President of Pakistan
234,Luciano Onder works for<extra_id_0>                                       ,RAI,Dell Inc.
235,Enrico dal Covolo holds the position of<extra_id_0>                                 ,titular bishop,diocesan bishop
236,Shakib Al Hasan plays for<extra_id_0>                                      ,Uthura Rudras,Al-Arabi SC
237,Vasile Blaga is a member of the<extra_id_0>                                    ,Democratic Liberal Party,National Liberal Party
238,Scott Frost works for<extra_id_0>                                          ,Oregon Ducks,The Guardian
239,Frans Van de Werf works for<extra_id_0>                                      ,European Society of Cardiology,Trek-Segafredo
240,<extra_id_0> is the chair of Bank of Lithuania                                        ,Vitas Vasiliauskas,ukas ukauius
241,Josep Rull i Andreu is a member of the<extra_id_0>                               ,Democratic Convergence of Catalonia,Democratic Convergence of Catalonia
242,Justin Welby holds the position of<extra_id_0>                                      ,Bishop of Durham,United States representative
243,<extra_id_0> is the head of the government of Changhua County                                   ,Cho Po-yuan,Zhu Xiaodan
244,Mette Frederiksen holds the position of<extra_id_0>                                   ,Danish Minister for Labour,Chief of Navy
245,WOSX is owned by<extra_id_0>                                        ,Denison University,Entercom
246,<extra_id_0> is the chair of Union rationaliste                                       ,Édouard Brézin,Peter O'Neill
247,Robbie Rogers plays for<extra_id_0>                                        ,Leeds United F.C.,England national association football team
248,Tom Finkelpearl works for<extra_id_0>                                      ,Queens Museum,NBC News
249,Gabriel Salazar works for<extra_id_0>                                         ,University of Chile,IESE Business School
250,<extra_id_0> is the head coach of LSU Tigers football                                     ,Les Miles,Jeff Fisher
251,Peggy Piesche works for<extra_id_0>                                        ,Hamilton College,University of Potsdam
252,Ann Sarnoff works for<extra_id_0>                                        ,BBC America,The Century Foundation
253,Peter Kohlgraf works for<extra_id_0>                                         ,University of Münster,Deutsche Bank
254,Seiya Ando attended<extra_id_0>                                       ,Meiji University,Yokohama High School
255,Eskil Br<unk> ndbo is a member of the<extra_id_0>                                ,Conservative Party of Norway,Fokus
256,Andris Piebalgs holds the position of<extra_id_0>                                   ,"European Commissioner for International Cooperation, Humanitarian Aid and Crisis Response",Prime Minister of Estonia
257,Didier Fassin works for<extra_id_0>                                      ,Institute for Advanced Study,RC Toulonnais
258,Joaquim Forn is a member of the<extra_id_0>                                  ,Democratic Convergence of Catalonia,Socialist Party
259,Maria Ohisalo attended<extra_id_0>                                        ,University of Eastern Finland,St. Katherine High School
260,Ghulam Rasool Sahi is a member of the<extra_id_0>                             ,Pakistan Muslim League (Q),All India Trinamool Congress
261,<extra_id_0> is the head coach of Legia Warsaw                                      ,Jan Urban,Stanislav Lev
262,Ron Estes holds the position of<extra_id_0>                                       ,Kansas State Treasurer,United States representative
263,Brian Mullan plays for<extra_id_0>                                         ,Colorado Rapids,Ireland national association football team
264,Shelley Moore Capito holds the position of<extra_id_0>                                   ,United States representative,United States representative
265,Emanuela Del Gado works for<extra_id_0>                                   ,ETH Zurich,Cadena COPE
266,Shay Given plays for<extra_id_0>                                         ,Aston Villa F.C.,West Ham United F.C.
267,Chris Huhne holds the position of<extra_id_0>                                       ,Secretary of State for Energy and Climate Change,United States representative
268,Jesse Robredo holds the position of<extra_id_0>                                     ,Secretary of the Interior and Local Government,United States representative
269,James McClean plays for<extra_id_0>                                        ,Sunderland A.F.C.,England national association football team
270,Romelu Lukaku plays for<extra_id_0>                                      ,Belgium national football team,A.S. Roma
271,<extra_id_0> is the head coach of Angers SCO                                     ,Stéphane Moulin,Jean-Claude Boulard
272,Sabrina Ionescu attended<extra_id_0>                                      ,Miramonte High School,Universidade Estadual Paulista
273,<extra_id_0> is the chair of Progressive Party of Maldives                                     ,Maumoon Abdul Gayoom,Mahmoud Ahmadinejad
274,Rahm Emanuel holds the position of<extra_id_0>                                   ,Mayor of Chicago,President of Nigeria
275,Kari Turunen holds the position of<extra_id_0>                                     ,chairperson,Prime Minister of Finland
276,Nikólaos Chount<unk> s is a member of the<extra_id_0>                             ,SYRIZA,Lithuanian Democratic Party
277,Nordic Regional Airlines is owned by<extra_id_0>                                        ,Flybe,Norwegian National Rail Administration
278,Gareth Barry plays for<extra_id_0>                                        ,England national association football team,England national association football team
279,Lucas Richman works for<extra_id_0>                                         ,Bangor Symphony Orchestra,Microsoft Corporation
280,Chris Bowen holds the position of<extra_id_0>                                       ,Minister for Immigration and Border Protection of Australia,United States representative
281,Luis Almagro holds the position of<extra_id_0>                                      ,foreign minister,Prime Minister of Ecuador
282,Thorgan Hazard plays for<extra_id_0>                                         ,R.C. Lens,France national association football team
283,Chen Guangcheng works for<extra_id_0>                                       ,New York University,China Central Television
284,Julie Ertz plays for<extra_id_0>                                         ,United States women's national under-20 soccer team,Germany national association football team
285,Antonino Raspanti holds the position of<extra_id_0>                                    ,diocesan bishop,Prime Minister of Croatia
286,Ian Jacobs works for<extra_id_0>                                         ,University of Manchester,NBC News
287,Dominique Mamberti holds the position of<extra_id_0>                                     ,Secretary for Relations with States,diocesan bishop
288,Katherine Joy works for<extra_id_0>                                          ,University of Manchester,University of Kent
289,Meng Wanzhou holds the position of<extra_id_0>                                     ,chief financial officer,Vice President of the Republic of China
290,Shoaib Malik plays for<extra_id_0>                                      ,Pakistan national cricket team,Pakistan national football team
291,Anam Vivekananda Reddy is a member of the<extra_id_0>                               ,Indian National Congress,Member of a Legislative Assembly of India
292,Philip A Gale works for<extra_id_0>                                       ,University of Southampton,University of Notre Dame
293,Bergen Line is owned by<extra_id_0>                                        ,Norwegian National Rail Administration,Norwegian National Rail Administration
294,Amar Gupta works for<extra_id_0>                                      ,University of Arizona,Tata Group
295,Melania Cristescu works for<extra_id_0>                                       ,University of Windsor,Universidade Estadual Paulista
296,<extra_id_0> is the head of the government of Texas                                       ,Rick Perry,Elon Musk
297,John L Hennessy holds the position of<extra_id_0>                                   ,president,United States representative
298,Joseph Daul holds the position of<extra_id_0>                                       ,member of the European Parliament,United States representative
299,Stephen Hawking works for<extra_id_0>                                         ,University of Cambridge,NBC News
300,Trent Kelly holds the position of<extra_id_0>                                        ,district attorney,Teachta Dála
301,<extra_id_0> is the head of the government of Hawaii                                       ,Neil Abercrombie,Peter O'Neill
302,Vera Papisova works for<extra_id_0>                                      ,Massachusetts General Hospital,RT
303,Thomas Hutzschenreuter works for<extra_id_0>                                      ,WHU-Otto Beisheim School of Management,Max Planck Institute for Solid State Research
304,<extra_id_0> is the head coach of SV Waldhof Mannheim                                   ,Reiner Hollich,Martin Heuberger
305,Dan Satterberg is a member of the<extra_id_0>                                    ,Republican Party,Republican Party
306,Didier Digard plays for<extra_id_0>                                        ,OGC Nice,France national association football team
307,<extra_id_0> is the chair of RCD Mallorca                                        ,Lorenzo Serra Ferrer,José Luis Arrieta
308,<extra_id_0> is the head coach of FC Spartak Trnava                                   ,Pavel Hoftych,Igor Kriushenko
309,Armen Amiryan works for<extra_id_0>                                      ,Armenian State Pedagogical University,Armenian National Security Council
310,Rob Gronkowski plays for<extra_id_0>                                        ,New England Patriots,New York Yankees
311,Gustavo Petro is a member of the<extra_id_0>                                     ,Movimiento Progresistas (izquierda),People's Party
312,Roberto Cassinelli is a member of the<extra_id_0>                                   ,The People of Freedom,The People of Freedom
313,Bradley Wiggins plays for<extra_id_0>                                        ,Ineos Grenadier,England national association football team
314,Tyrese Maxey attended<extra_id_0>                                      ,South Garland High School,St. Louis Cardinals
315,Chris Lu holds the position of<extra_id_0>                                        ,White House Cabinet Secretary,United States representative
316,Rodrigo Palacio plays for<extra_id_0>                                      ,Genoa C.F.C.,Real Madrid CF
317,Akram Hasson is a member of the<extra_id_0>                                    ,Kadima,All-Pakistan Muslim League
318,Edward Garnier holds the position of<extra_id_0>                                       ,Solicitor General for England and Wales,United States representative
319,Nicole Bricq is a member of the<extra_id_0>                                    ,Socialist Party,Union for a Popular Movement
320,Corina Crețu is a member of the<extra_id_0>                                  ,Social Democratic Party,Democratic Liberal Party
321,Ertharin Cousin holds the position of<extra_id_0>                                   ,executive director,United States representative
322,Richard G Whitman works for<extra_id_0>                                       ,University of Kent,"University of California, Berkeley"
323,Robinho plays for<extra_id_0>                                          ,Brazil national football team,FC Shakhtar Donetsk
324,Mohammad Bagher Ghalibaf holds the position of<extra_id_0>                                ,Mayor of Tehran,President of Pakistan
325,Masaaki <unk> sawa is a member of the<extra_id_0>                                 ,independent politician,Democratic Party of Japan
326,Gitta Kutyniok works for<extra_id_0>                                  ,Technical University of Berlin,Yitzchak Mirzov
327,Annegret Kramp-Karrenbauer holds the position of<extra_id_0>                               ,chairperson,Prime Minister of Luxembourg
328,Shafiqur Rahman Barq is a member of the<extra_id_0>                               ,Bahujan Samaj Party,Pakistan Peoples Party
329,Luciano Becchio plays for<extra_id_0>                                     ,Leeds United F.C.,Juventus FC
330,Paola Binetti is a member of the<extra_id_0>                                    ,Union of the Centre,The People of Freedom
331,Jang Geun-suk attended<extra_id_0>                                      ,Hanyang University,University of North Korea
332,Ferran Bel Accensi is a member of the<extra_id_0>                                ,Democratic Convergence of Catalonia,The People of Freedom
333,<extra_id_0> is the head coach of Tennis Borussia Berlin                                      ,Markus Schatte,Walter Planckaert
334,<extra_id_0> is the head coach of Borussia Dortmund                                       ,Jürgen Klopp,Walter Planckaert
335,Ben Carson is a member of the<extra_id_0>                                      ,independent politician,Republican Party
336,Jean-Paul Garraud is a member of the<extra_id_0>                                  ,Union for a Popular Movement,Union for a Popular Movement
337,Jimmy Bullard plays for<extra_id_0>                                         ,Milton Keynes Dons F.C.,England national association football team
338,Misty Jenkins works for<extra_id_0>                                        ,Peter MacCallum Cancer Centre,The Century Foundation
339,<extra_id_0> is the head coach of Sint-Truidense VV                               ,Franky Van der Elst,Paul van Gaal
340,Misbah-ul-Haq plays for<extra_id_0>                                    ,Sui Northern Gas Pipelines Limited,Pakistan national football team
341,Vladimir Ashurkov works for<extra_id_0>                                        ,Anti-corruption Foundation,Yuri Gagarin Cosmonaut Training Center
342,Richie McCaw plays for<extra_id_0>                                      ,Crusaders,West Ham United F.C.
343,<extra_id_0> is the chair of Green League                                         ,Ville Niinistö,Jacques Rogge
344,Mustapha Madih works for<extra_id_0>                                      ,Hassania Agadir,UMMC Ekaterinburg
345,<extra_id_0> is the head coach of Gençlerbirli<unk> i SK                              ,Fuat Çapa,Recep Tayyip Erdoan
346,Anneloes van Veen attended<extra_id_0>                                     ,Erasmus University Rotterdam,AZ Alkmaar
347,<extra_id_0> is the chair of Jammu and Kashmir Peoples Democratic Party                                 ,Mufti Mohammad Sayeed,Allan Singh
348,Jessica Shepard attended<extra_id_0>                                         ,Fremont Senior High School,St. Katherine High School
349,Hannah Dee works for<extra_id_0>                                         ,Aberystwyth University,University of Kent
350,Hickory Daily Record is owned by<extra_id_0>                                     ,Berkshire Hathaway,The Century Foundation
351,Beatrice Brignone is a member of the<extra_id_0>                                   ,Democratic Party,The People of Freedom
352,Matthew DeGennaro works for<extra_id_0>                                      ,The Rockefeller University,The Century Foundation
353,Craig Gordon plays for<extra_id_0>                                          ,Sunderland A.F.C.,Australia national association football team
354,Amiruddin Hamzah is a member of the<extra_id_0>                                 ,Malaysian Islamic Party,United Malays National Organisation
355,<extra_id_0> is the chair of BayernSPD                                        ,Florian Pronold,Wolfgang Gerhardt
356,<extra_id_0> is the head coach of University College Dublin AFC                                 ,Martin Russell,Declan Kidney
357,Gheorghe Falcă is a member of the<extra_id_0>                                  ,Democratic Liberal Party,National Liberal Party
358,Anna J<unk> lia Donáth attended<extra_id_0>                                    ,Eötvös Loránd University,eské dráhy
359,Westfield Wheaton is owned by<extra_id_0>                                       ,Westfield Group,Westfield Group
360,Sabine Schmidtke works for<extra_id_0>                                        ,Freie Universität Berlin,Deutsche Bank
361,<extra_id_0> is the head of the government of Milan                                       ,Giuliano Pisapia,Silvio Berlusconi
362,Adrián González plays for<extra_id_0>                                      ,Boston Red Sox,Real Madrid CF
363,Fraser Forster plays for<extra_id_0>                                         ,Newcastle United F.C.,Australia national association football team
364,Heather Bresch holds the position of<extra_id_0>                                       ,chief executive officer,United States representative
365,511 Federal Building is owned by<extra_id_0>                                       ,General Services Administration,Bank of America
366,Dacian Cioloș holds the position of<extra_id_0>                                     ,European Commissioner for Agriculture and Rural Development,Prime Minister of Romania
367,Yoh Iwasa works for<extra_id_0>                                       ,Kyushu University,Yokohama
368,Louis Moresi works for<extra_id_0>                                        ,Monash University,SNCF
369,Dianne F Harrison works for<extra_id_0>                                       ,"California State University, Monterey Bay","University of California, Berkeley"
370,Nadarajah Asokan works for<extra_id_0>                                    ,University of Helsinki,Ministry of Defence
371,Serdar Berdimuhamedow attended<extra_id_0>                                    ,Geneva Centre for Security Policy,Faculty of Management of the University of Baku
372,<extra_id_0> is the chair of Rio Tinto Group                                       ,Jan du Plessis,Jacques Rogge
373,<extra_id_0> is the head of the government of Bourges                                      ,Serge Lepeltier,Jean-Claude Boulard
374,Jürgen Klopp works for<extra_id_0>                                       ,Borussia Dortmund,Volkswagen Group
375,<extra_id_0> is the head coach of Pauwels Sauzen-Bingoal                               ,Mario De Clercq,Jean-Claude Boulard
376,Tia Eron is a member of the<extra_id_0>                                    ,Republicanos,People's Justice Party
377,James Dolan works for<extra_id_0>                                         ,SecureDrop,Google
378,Alberto Contador plays for<extra_id_0>                                        ,Tinkoff,Real Madrid CF
379,Todd Rokita holds the position of<extra_id_0>                                      ,United States representative,United States representative
380,Asia Durr attended<extra_id_0>                                          ,St. Pius X Catholic High School,INSEP
381,Boxer TV Access is owned by<extra_id_0>                                       ,Teracom,Global Media
382,Charlotte Hornets is owned by<extra_id_0>                                       ,Michael Jordan,The New York Times Company
383,Cesc Fàbregas plays for<extra_id_0>                                      ,FC Barcelona,FC Barcelona
384,Muttiah Muralitharan plays for<extra_id_0>                                   ,Gloucestershire County Cricket Club,Tamil Union Cricket and Athletic Club
385,Marcelo plays for<extra_id_0>                                          ,Brazil Olympic football team,Real Madrid CF
386,Aaron Judge plays for<extra_id_0>                                          ,Fresno State Bulldogs baseball,Miami Dolphins
387,<extra_id_0> is the head of the government of Pescara                                    ,Luigi Albore Mascia,Mario Monti
388,<extra_id_0> is the chair of Rhode Island School of Design                                      ,John Maeda,Susan Hockfield
389,Pernille Vermund is a member of the<extra_id_0>                                 ,Conservative People's Party,Union for a Popular Movement
390,P J Fleck works for<extra_id_0>                                      ,Tampa Bay Buccaneers,Google
391,Éamon <unk> Cu<unk> v holds the position of<extra_id_0>                                  ,Teachta Dála,Teachta Dála
