392,Henrikh Mkhitaryan plays for<extra_id_0>                                   ,FC Shakhtar Donetsk,France national association football team
393,Jonah Berger works for<extra_id_0>                                        ,University of Pennsylvania,University of Oslo
394,Victor Oladipo plays for<extra_id_0>                                       ,Indiana Hoosiers men's basketball,FC Shakhtar Donetsk
395,Ronan OGara plays for<extra_id_0>                                      ,Munster Rugby,Aston Villa F.C.
396,<extra_id_0> is the head coach of Carolina Panthers                                       ,Ron Rivera,Steve Bruce
397,Syed Mustafa Kamal is a member of the<extra_id_0>                                ,Muttahida Qaumi Movement,United Malays National Organisation
398,<extra_id_0> is the chair of Peoples Freedom Party                                      ,Vladimir Ryzhkov,Anna Troberg
399,Pranab Mukherjee holds the position of<extra_id_0>                                 ,Minister of Finance,Member of a Legislative Assembly of India
400,Wojciech Szcz<unk> sny plays for<extra_id_0>                                ,Arsenal F.C.,Poland national association football team
401,Chloe Bibby attended<extra_id_0>                                      ,Rowville Secondary College,St. Katherine High School
402,Christiane Endler plays for<extra_id_0>                                        ,South Florida Bulls,Germany national association football team
403,Chris Turney works for<extra_id_0>                                         ,University of New South Wales,NBC News
404,Marissa Mayer works for<extra_id_0>                                        ,Google,Google
405,CY Leung holds the position of<extra_id_0>                                      ,Chief Executive of Hong Kong,Vice President of the Legislative Yuan
406,Federico Macheda plays for<extra_id_0>                                       ,Italy national under-21 football team,Real Madrid CF
407,<extra_id_0> is the chair of Welsh Parliament                                         ,Rosemary Butler,Yitzchak Shamir
408,Ryan Babel plays for<extra_id_0>                                         ,TSG 1899 Hoffenheim,Australia national association football team
409,Erin McLeod plays for<extra_id_0>                                      ,Dalsjöfors GoIF,Australia national association football team
410,<extra_id_0> is the head of the government of Boise                                     ,David H. Bieter,Peter Shumlin
411,Wishnutama works for<extra_id_0>                                        ,Trans TV,Microsoft Corporation
412,Ellen D Williams works for<extra_id_0>                                        ,bp,"University of California, Berkeley"
413,<extra_id_0> is the chair of Open Source Initiative                                        ,Simon Phipps,Jacques Rogge
414,Nicolás Maduro holds the position of<extra_id_0>                                   ,Vice President of Venezuela,Prime Minister of Ecuador
415,<extra_id_0> is the chair of Caritas Italiana                                     ,Giuseppe Merisi,Silvio Berlusconi
416,Santi Vila i Vicente is a member of the<extra_id_0>                                ,Democratic Convergence of Catalonia,Democratic Convergence of Catalonia
417,Aleksa Be<unk> i<unk> is a member of the<extra_id_0>                                 ,Socialist People's Party of Montenegro,Serbian Radical Party
418,Ferrari is owned by<extra_id_0>                                          ,Fiat S.p.A.,Ferrari Corporation
419,Pepe plays for<extra_id_0>                                          ,Real Madrid CF,Real Madrid CF
420,Catherine Guillouard works for<extra_id_0>                                       ,Eutelsat,RC Toulonnais
421,Carlo Rovelli works for<extra_id_0>                                       ,Aix-Marseille University,Ferrari
422,Monta Ellis plays for<extra_id_0>                                         ,Golden State Warriors,France national association football team
423,Justin Thomas attended<extra_id_0>                                           ,University of Alabama,St. Stephen's Episcopal School
424,Chris Lattner works for<extra_id_0>                                       ,Apple Inc.,Google
425,<extra_id_0> is the head of the government of Hamburg                                       ,Olaf Scholz,Peter den Oudsten
426,Thorbj<unk> rn Jagland holds the position of<extra_id_0>                                 ,Secretary General of the Council of Europe,Chief of Navy
427,Johan Djourou plays for<extra_id_0>                                       ,Arsenal F.C.,France national association football team
428,Paul Butler holds the position of<extra_id_0>                                        ,Bishop of Southwell and Nottingham,United States representative
429,Audun Lysbakken holds the position of<extra_id_0>                                   ,party leader,Chief of Navy
430,Vince Cable holds the position of<extra_id_0>                                        ,"Secretary of State for Business, Energy and Industrial Strategy",United States representative
431,Lamar Jackson attended<extra_id_0>                                          ,Boynton Beach Community High School,Westwind Preparatory Academy
432,Dina Bousselham is a member of the<extra_id_0>                                   ,Authenticity and Modernity Party,Union for a Popular Movement
433,<extra_id_0> is the head of the government of Pau                                      ,Martine Lignières-Cassou,Jean-Claude Boulard
434,Yu Darvish plays for<extra_id_0>                                        ,Texas Rangers,India national cricket team
435,Peter Mathieson works for<extra_id_0>                                        ,University of Bristol,University of Kent
436,<extra_id_0> is the chair of PEN International                                        ,John R. Saul,Jacques Rogge
437,Kevin-Prince Boateng plays for<extra_id_0>                                      ,Ghana national football team,France national association football team
438,<extra_id_0> is the head of the government of Sahrawi Arab Democratic Republic                                 ,Abdelkader Taleb Omar,Mohammed Basindawa
439,<extra_id_0> is the chair of Supreme Court of Justice                                       ,Eckart Ratz,Jacques Rogge
440,Clive Palmer is a member of the<extra_id_0>                                     ,Liberal National Party of Queensland,Liberal Party of Australia
441,Stephanie Wehner works for<extra_id_0>                                        ,Centre for Quantum Technologies,The New York Times
442,<extra_id_0> is the head of the government of Auckland                                       ,Len Brown,Peter O'Neill
443,<extra_id_0> is the head coach of FC Ural Yekaterinburg                                   ,Pavel Gusev,Igor Kriushenko
444,Pier Paolo Pandolfi works for<extra_id_0>                                   ,Beth Israel Deaconess Medical Center,Dell Inc.
445,Micael Bydén holds the position of<extra_id_0>                                   ,Commander of the Air Force,Prime Minister of Namibia
29,0.06502242152466367
